ken_code,ken_description,basic_cost,mean_duration_days,extra_daily_cost
Α33ΜΑ,Πλευριτική συλλογή με καταστροφικές συνυπάρχουσες παθήσεις - επιπλοκές,2023.00,10,202.30
Α33ΜΒ,Πλευριτική συλλογή με σοβαρές ή μεσαίου βαρύτητας συνυπάρχουσες παθήσεις - επιπλοκές,1043.00,5,208.60
Α33Χ,Πλευριτική συλλογή χωρίς συνυπάρχουσες παθήσεις - επιπλοκές,607.00,3,202.33
Α34ΜΑ,Διάμεση πνευμονική νόσος με καταστροφικές συνυπάρχουσες παθήσεις - επιπλοκές,1977.00,10,197.70
Α34ΜΒ,Διάμεση πνευμονική νόσος με σοβαρές ή μεσαίας βαρύτητας συνυπάρχουσες παθήσεις – επιπλοκές,1393.00,7,199.00
Α34Χ,Διάμεση πνευμονική νόσος χωρίς συνυπάρχουσες παθήσεις - επιπλοκές,638.00,3,212.67
Α35ΜΑ,Λοιπές διαγνώσεις αναπνευστικού συστήματος με καταστροφικές συνυπάρχουσες παθήσεις - επιπλοκές,1556.00,8,194.50
Α35ΜΒ,Λοιπές διαγνώσεις αναπνευστικού συστήματος με σοβαρές ή μεσαίας βαρύτητας συνυπάρχουσες παθήσεις – επιπλοκές,973.00,5,194.60
Α35Χ,Λοιπές διαγνώσεις αναπνευστικού συστήματος χωρίς συνυπάρχουσες παθήσεις - επιπλοκές,475.00,2,237.50
Α36Α,Φυματίωση αναπνευστικού,2412.00,14,172.29
Κ01Μ,"Τοποθέτηση ή αντικατάσταση εμφυτεύσιμου απινιδωτή, ολικό σύστημα με καταστροφικές συνυπάρχουσες παθήσεις - επιπλοκές",16215.00,12,1351.25
Κ01Χ,"Τοποθέτηση ή αντικατάσταση εμφυτεύσιμου απινιδωτή, ολικό σύστημα χωρίς καταστροφικές συνυπάρχουσες παθήσεις-επιπλοκές",12420.00,3,4140.00
Κ02Α,Άλλες επεμβάσεις επί εμφυτεύσιμου απινιδωτή,2844.00,4,711.00
Κ03Μ,Επεμβάσεις σε καρδιακές βαλβίδες με εξωσωματική κυκλοφορία και με επεμβατικό καρδιακό καθετηριασμό με καταστροφικές συνυπάρχουσες παθήσεις-επιπλοκές,15429.00,23,670.83
Κ03Χ,Επεμβάσεις σε καρδιακές βαλβίδες με εξωσωματική κυκλοφορία και με επεμβατικό καρδιακό καθετηριασμό χωρίς καταστροφικές συνυπάρχουσες παθήσεις-επιπλοκές,11734.00,13,902.62
Κ04Μ,Επεμβάσεις σε καρδιακές βαλβίδες με εξωσωματική κυκλοφορία χωρίς επεμβατικό καρδιακό καθετηριασμό και με καταστροφικές συνυπάρχουσες παθήσεις-επιπλοκές,13155.00,14,939.64
Κ04Χ,Επεμβάσεις σε καρδιακές βαλβίδες με εξωσωματική κυκλοφορία χωρίς επεμβατικό καρδιακό καθετηριασμό και χωρίς καταστροφικές συνυπάρχουσες παθήσεις-επιπλοκές,9163.00,8,1145.38
Κ05Μ,Αορτοστεφανιαία παράκαμψη με καρδιακό καθετηριασμό με επανεπέμβαση με καταστροφικές συνυπάρχουσες παθήσεις-επιπλοκές,10023.00,18,556.83
Κ05Χ,Αορτοστεφανιαία παράκαμψη με καρδιακό καθετηριασμό χωρίς επανεπέμβαση χωρίς καταστροφικές συνυπάρχουσες παθήσεις-επιπλοκές,7270.00,13,559.23
Κ06Μ,Αορτοστεφανιαία παράκαμψη χωρίς καρδιακό καθετηριασμό με επανεπέμβαση ή με καταστροφικές / σοβαρές συνυπάρχουσες παθήσεις-επιπλοκές,7182.00,10,718.20
Κ06Χ,Αορτοστεφανιαία παράκαμψη χωρίς καρδιακό καθετηριασμό χωρίς επανεπέμβαση χωρίς καταστροφικές συνυπάρχουσες παθήσεις-επιπλοκές,5077.00,7,725.29
Κ07ΜΑ,Λοιπές κάρδιο-θώρακοχειρουργικές /αγγειοχειρουργικές επεμβάσεις με εξωσωματική κυκλοφορία με καταστροφικές συνυπάρχουσες παθήσεις-επιπλοκές,10554.00,12,879.50
Κ07ΜΒ,Λοιπές κάρδιο-θώρακοχειρουργικές /αγγειοχειρουργικές επεμβάσεις με εξωσωματική κυκλοφορία με σοβαρές ή μετρίας βαρύτητας συνυπάρχουσες παθήσεις-επιπλοκές,7279.00,8,909.88
Κ07Χ,Λοιπές κάρδιο-θώρακοχειρουργικές /αγγειοχειρουργικές επεμβάσεις με εξωσωματική κυκλοφορία χωρίς συνυπάρχουσες παθήσεις-επιπλοκές,5354.00,7,764.86
Κ08Μ,Μείζονες επανορθωτικές επεμβάσεις αγγείων χωρίς εξωσωματική κυκλοφορία με καταστροφικές συνυπάρχουσες παθήσεις-επιπλοκές,8956.00,16,559.75
Κ08Χ,Μείζονες επανορθωτικές επεμβάσεις αγγείων χωρίς εξωσωματική κυκλοφορία χωρίς καταστροφικές συνυπάρχουσες παθήσεις-επιπλοκές,5561.00,7,794.43
Κ09ΜΑ,Λοιπές κάρδιοθωρακικές χειρουργικές επεμβάσεις χωρίς εξωσωματική κυκλοφορία με καταστροφικές συνυπάρχουσες παθήσεις-επιπλοκές,6413.00,10,641.30
Κ09ΜΒ,Άλλες κάρδιο-θώρακοχειρουργικές επεμβάσεις χωρίς εξωσωματική κυκλοφορία με σοβαρής ή μέτριας βαρύτητας συνυπάρχουσες παθήσεις-επιπλοκές,3617.00,6,602.83
Κ09Χ,Άλλες κάρδιο-θώρακοχειρουργικές επεμβάσεις χωρίς εξωσωματική κυκλοφορία χωρίς συνυπάρχουσες παθήσεις-επιπλοκές,2386.00,3,795.33
Κ10Μ,Επεμβατικές στεφανιαίες επεμβάσεις με ΟΕΜ (οξύ έμφραγμα μυοκαρδίου) με καταστροφικές συνυπάρχουσες παθήσεις-επιπλοκές,4166.00,8,520.75
Κ10Χ,Επεμβατικές στεφανιαίες επεμβάσεις με ΟΕΜ (οξύ έμφραγμα μυοκαρδίου) χωρίς καταστροφικές συνυπάρχουσες παθήσεις-επιπλοκές,2724.00,4,681.00
Κ11Μ,"Ακρωτηριασμός λόγω αγγειακής ισχαιμίας, πλην άνω άκρου και δακτύλων άκρου ποδός, με καταστροφικές συνυπάρχουσες παθήσεις-επιπλοκές",7292.00,27,270.07
Κ11Χ,"Ακρωτηριασμός λόγω αγγειακής ισχαιμίας, πλην άνω άκρου και δακτύλων άκρου ποδός, χωρίς καταστροφικές συνυπάρχουσες παθήσεις-επιπλοκές",3223.00,14,230.21
Κ12Μ,"Τοποθέτηση ή αντικατάσταση βηματοδότη, ολικού συστήματος, με καταστροφικές συνυπάρχουσες παθήσεις-επιπλοκές",5465.00,11,496.82
Κ12Χ,"Τοποθέτηση ή αντικατάσταση βηματοδότη, ολικού συστήματος χωρίς καταστροφικές συνυπάρχουσες παθήσεις-επιπλοκές",3694.00,4,923.50
Κ13Μ,Ακρωτηριασμός άνω άκρου ή δακτύλου άκρου ποδός λόγω νοσήματος κυκλοφορικού με σοβαρού βαθμού ή καταστροφικές συνυπάρχουσες παθήσεις-επιπλοκές,3969.00,17,233.47
Κ13Χ,Ακρωτηριασμός άνω άκρου ή δακτύλου άκρου ποδός λόγω καρδιαγγειακού νοσήματος χωρίς σοβαρού βαθμού ή καταστροφικές συνυπάρχουσες παθήσεις-επιπλοκές,1660.00,7,237.14
Κ14ΜΑ,"Αγγειακές επεμβάσεις, πλην μειζόνων επανορθωτικών επεμβάσεων, χωρίς εξωσωματική κυκλοφορία με καταστροφικές συνυπάρχουσες παθήσεις-επιπλοκές",3569.00,11,324.45
Κ14ΜΒ,"Αγγειακές επεμβάσεις, πλην μειζόνων επανορθωτικών επεμβάσεων, χωρίς εξωσωματική κυκλοφορία, με σοβαρού ή μετρίου βαθμού συνυπάρχουσες παθήσεις-επιπλοκές",1991.00,4,497.75
Κ14Χ,"Αγγειακές επεμβάσεις, πλην μειζόνων επανορθωτικών επεμβάσεων, χωρίς εξωσωματική κυκλοφορία χωρίς συνυπάρχουσες παθήσεις-επιπλοκές",1277.00,2,638.50
Κ15Μ,Επεμβατικές στεφανιαίες επεμβάσεις χωρίς ΟΕΜ (οξύ έμφραγμα μυοκαρδίου) με τοποθέτηση ενδοπρόθεσης (stent) με σοβαρού βαθμού ή καταστροφικές συνυπάρχουσες παθήσεις-επιπλοκές,2728.00,4,682.00
Κ15Χ,Επεμβατικές στεφανιαίες επεμβάσεις χωρίς ΟΕΜ (οξύ έμφραγμα μυοκαρδίου) με τοποθέτηση ενδοπρόθεσης (stent) χωρίς σοβαρού βαθμού ή καταστροφικές συνυπάρχουσες παθήσεις-επιπλοκές,2013.00,2,1006.50
Κ16Μ,Επεμβατικές στεφανιαίες επεμβάσεις χωρίς ΟΕΜ (οξύ έμφραγμα μυοκαρδίου) χωρίς τοποθέτηση ενδοπρόθεσης (stent) με συνυπάρχουσες παθήσεις-επιπλοκές,1531.00,3,510.33
Κ16Χ,Επεμβατικές μέθοδοι στα στεφανιαία χωρίς ΟΕΜ (οξύ έμφραγμα μυοκαρδίου) χωρίς τοποθέτηση ενδοπρόθεσης (stent) χωρίς συνυπάρχουσες παθήσεις-επιπλοκές,1118.00,2,559.00
Κ17Μ,Τοποθέτηση ή αντικατάσταση γεννήτριας βηματοδότη με σοβαρού βαθμού ή καταστροφικές συνυπάρχουσες παθήσεις-επιπλοκές,2892.00,5,578.40
Κ17Χ,Τοποθέτηση ή αντικατάσταση γεννήτριας βηματοδότη χωρίς σοβαρού βαθμού ή καταστροφικές συνυπάρχουσες παθήσεις-επιπλοκές,2617.00,1,2617.00
Κ18Μ,Λοιπές επεμβάσεις με βηματοδότη με συνυπάρχουσες παθήσεις-επιπλοκές,2226.00,7,318.00
Κ18Χ,Λοιπές επεμβάσεις με βηματοδότη χωρίς συνυπάρχουσες παθήσεις-επιπλοκές,1146.00,2,573.00
Κ19Α,Διαδερμικές ενδοαγγειακές καρδιακές επεμβάσεις,3194.00,3,1064.67
Κ20Α,Απολίνωση φλέβας,760.00,1,760.00
Κ21Μ,Λοιπές επεμβάσεις νοσημάτων κυκλοφορικού με συνυπάρχουσες παθήσεις-επιπλοκές,3680.00,15,245.33
Κ21Χ,Λοιπές επεμβάσεις νοσημάτων κυκλοφορικού χωρίς καταστροφικές συνυπάρχουσες παθήσεις-επιπλοκές,1494.00,4,373.50
Κ22Α,Αορτικά Βαλβιδοφόρα Μοσχεύματα,7753.00,15,516.87
Κ30Μ,Νοσήματα κυκλοφορικού με μηχανική υποστήριξη αναπνοής (αναπνευστήρα) με καταστροφικές συνυπάρχουσες παθήσεις-επιπλοκές,6295.00,11,572.27
Κ30Χ,Νοσήματα κυκλοφορικού με μηχανική υποστήριξη αναπνοής (αναπνευστήρα) χωρίς καταστροφικές συνυπάρχουσες παθήσεις-επιπλοκές,4470.00,6,745.00
Κ31Μ,Νοσήματα κυκλοφορικού με ΟΕΜ με διαγνωστική επεμβατική καρδιακή τεχνική με σοβαρού βαθμού ή καταστροφικές συνυπάρχουσες παθήσεις-επιπλοκές,2038.00,8,254.75
Κ31Χ,παθήσεις-επιπλοκές του κυκλοφορικού με ΟΕΜ με διαγνωστική επεμβατική καρδιακή τεχνική χωρίς σοβαρού βαθμού ή καταστροφικές συνυπάρχουσες παθήσεις-επιπλοκές,1183.00,4,295.75
Κ32Α,"παθήσεις-επιπλοκές του κυκλοφορικού χωρίς ΟΕΜ με διαγνωστική επεμβατική καρδιακή τεχνική, την ίδια ημέρα",1043.00,1,1043.00
Κ32Μ,παθήσεις-επιπλοκές του κυκλοφορικού χωρίς ΟΕΜ με διαγνωστική επεμβατική καρδιακή τεχνική με σοβαρού βαθμού ή καταστροφικές συνυπάρχουσες παθήσεις-επιπλοκές,2062.00,8,257.75
Κ32Χ,παθήσεις-επιπλοκές του κυκλοφορικού χωρίς ΟΕΜ με διαγνωστική επεμβατική καρδιακή τεχνική χωρίς σοβαρού βαθμού ή καταστροφικές συνυπάρχουσες παθήσεις-επιπλοκές,1089.00,3,363.00
Κ33Α,Διάγνωση κυκλοφορικού με μη επεμβατικό μηχανικό αερισμό,3132.00,13,240.92
Κ40Μ,Διαταραχές κυκλοφορικού με ΟΕΜ χωρίς διαγνωστική επεμβατική καρδιακή τεχνική με καταστροφικές συνυπάρχουσες παθήσεις-επιπλοκές,2000.00,10,200.00
Κ40Χ,Διαταραχές κυκλοφορικού με ΟΕΜ χωρίς διαγνωστική επεμβατική καρδιακή τεχνική χωρίς καταστροφικές συνυπάρχουσες παθήσεις-επιπλοκές,794.00,3,264.67
Κ41Μ,Λοιμώδης ενδοκαρδίτιδα με καταστροφικές συνυπάρχουσες παθήσεις-επιπλοκές,4801.00,22,218.23
Κ41Χ,Λοιμώδης ενδοκαρδίτιδα χωρίς καταστροφικές συνυπάρχουσες παθήσεις-επιπλοκές,2397.00,12,199.75
Κ42Μ,Καρδιακή ανεπάρκεια και καταπληξία (SCHOCK) με καταστροφικές συνυπάρχουσες παθήσεις,2054.00,10,205.40
Κ42Χ,Καρδιακή ανεπάρκεια και καταπληξία (SCHOCK) χωρίς καταστροφικές συνυπάρχουσες παθήσεις,934.00,5,186.80
Κ43Μ,Φλεβοθρόμβωση με σοβαρού βαθμού ή καταστροφικές συνυπάρχουσες παθήσεις-επιπλοκές,1471.00,8,183.88
Κ33Χ,Φλεβοθρόμβωση χωρίς σοβαρού βαθμού ή καταστροφικές συνυπάρχουσες παθήσεις-επιπλοκές,669.00,5,133.80
Κ34Μ,Δερματικά έλκη σε παθήσεις-επιπλοκές κυκλοφορικού με σοβαρού βαθμού ή καταστροφικές συνυπάρχουσες παθήσεις-επιπλοκές,2233.00,13,171.77
Κ34Χ,Δερματικά έλκη σε παθήσεις-επιπλοκές κυκλοφορικού χωρίς σοβαρού βαθμού ή καταστροφικές συνυπάρχουσες παθήσεις-επιπλοκές,981.00,5,196.20
Κ35Μ,Περιφερική αγγειοπάθεια με σοβαρού βαθμού ή καταστροφικές συνυπάρχουσες παθήσεις-επιπλοκές,1502.00,7,214.57
Κ35Χ,Περιφερική αγγειοπάθεια χωρίς σοβαρού βαθμού ή καταστροφικές συνυπάρχουσες παθήσεις-επιπλοκές,521.00,2,260.50
Κ36Μ,Αθηρωμάτωση στεφανιαίων αρτηριών με σοβαρού βαθμού ή καταστροφικές συνυπάρχουσες παθήσεις-επιπλοκές,957.00,5,191.40
Κ36Χ,Αθηρωμάτωση στεφανιαίων αρτηριών χωρίς σοβαρού βαθμού ή καταστροφικές συνυπάρχουσες παθήσεις-επιπλοκές,374.00,2,187.00
Κ37Μ,Αρτηριακή υπέρταση με σοβαρού βαθμού ή καταστροφικές συνυπάρχουσες παθήσεις-επιπλοκές,1198.00,6,199.67
Κ37Χ,Αρτηριακή υπέρταση χωρίς σοβαρού βαθμού ή καταστροφικές συνυπάρχουσες παθήσεις-επιπλοκές,459.00,2,229.50
Κ38Μ,Συγγενής καρδιοπάθεια με συνυπάρχουσες παθήσεις-επιπλοκές,1284.00,4,321.00
Κ38Χ,Συγγενής καρδιοπάθεια χωρίς συνυπάρχουσες παθήσεις-επιπλοκές,627.00,1,627.00
Κ39Μ,Βαλβιδοπάθειες με σοβαρού βαθμού ή καταστροφικές συνυπάρχουσες παθήσεις-επιπλοκές,1268.00,6,211.33
Κ39Χ,Βαλβιδοπάθειες χωρίς σοβαρού βαθμού ή καταστροφικές συνυπάρχουσες παθήσεις-επιπλοκές,327.00,2,163.50
Κ43Χ,Συγκοπή και λιποθυμία χωρίς σοβαρού βαθμού ή καταστροφικές συνυπάρχουσες παθήσεις-επιπλοκές,397.00,2,198.50
Κ44Α,Θωρακικό άλγος,311.00,1,311.00
Κ45ΜΑ,Λοιπές παθήσεις-επιπλοκές κυκλοφορικού με καταστροφικές συνυπάρχουσες παθήσεις-επιπλοκές,2428.00,10,242.80
Κ45ΜΒ,Λοιπές παθήσεις-επιπλοκές κυκλοφορικού με μετρίου ή σοβαρού βαθμού συνυπάρχουσες παθήσεις-επιπλοκές,1019.00,4,254.75
Κ45Χ,Λοιπές παθήσεις-επιπλοκές κυκλοφορικού χωρίς συνυπάρχουσες παθήσεις-επιπλοκές,521.00,2,260.50
Κ46Μ,"Αρρυθμία, καρδιακή ανακοπή και διαταραχές αγωγιμότητας με σοβαρού βαθμού ή καταστροφικές συνυπάρχουσες παθήσεις-επιπλοκές",1245.00,6,207.50
Κ46Χ,"Αρρυθμία, καρδιακή ανακοπή και διαταραχές αγωγιμότητας χωρίς σοβαρού βαθμού ή καταστροφικές συνυπάρχουσες παθήσεις-επιπλοκές",444.00,2,222.00
Κ47Α,Κατάλυση αρρυθμιογόνων εστιών,2423.00,6,403.83
Π01Μ,Εκτομή ορθού με καταστροφικές συνυπάρχουσες παθήσεις - επιπλοκές,6489.00,18,360.50
Π01Χ,Εκτομή ορθού χωρίς καταστροφικές συνυπάρχουσες παθήσεις - επιπλοκές,3857.00,9,428.56
Π02Μ,Μείζονες επεμβάσεις λεπτού και παχέος εντέρου με καταστροφικές συνυπάρχουσες παθήσεις - επιπλοκές,5741.00,17,337.71
Π02Χ,Μείζονες επεμβάσεις λεπτού και παχέος εντέρου χωρίς καταστροφικές συνυπάρχουσες παθήσεις - επιπλοκές,2771.00,8,346.38
Π03Μ,"Επεμβάσεις στομάχου, οισοφάγου και δωδεκαδακτύλου με κακοήθεια ή με καταστροφικές συνυπάρχουσες παθήσεις - επιπλοκές",6908.00,17,406.35
Π03ΧΑ,"Επεμβάσεις στομάχου, οισοφάγου και δωδεκαδάκτυλου χωρίς κακοήθεια και σοβαρές ή μεσαίας βαρύτητας συνυπάρχουσες παθήσεις - επιπλοκές",2826.00,8,353.25
Π03ΧΒ,"Επεμβάσεις στομάχου, οισοφάγου και δωδεκαδάκτυλου χωρίς κακοήθεια χωρίς συνυπάρχουσες παθήσεις - επιπλοκές",1813.00,4,453.25
Π04ΜΑ,Λύση περιτοναϊκών συμφύσεων με καταστροφικές συνυπάρχουσες παθήσεις - επιπλοκές,4847.00,16,302.94
Π04ΜΒ,Λύση περιτοναϊκών συμφύσεων με σοβαρές ή μεσαίας βαρύτητας συνυπάρχουσες παθήσεις - επιπλοκές,2710.00,9,301.11
Π04Χ,Λύση περιτοναϊκών συμφύσεων χωρίς συνυπάρχουσες παθήσεις - επιπλοκές,1578.00,4,394.50
Π05ΜΑ,Μικρές επεμβάσεις λεπτού και παχέος εντέρου με καταστροφικές συνυπάρχουσες παθήσεις - επιπλοκές,3329.00,12,277.42
Π05ΜΒ,Μικρές επεμβάσεις λεπτού και παχέος εντέρου με σοβαρές ή μεσαίας βαρύτητας συνυπάρχουσες παθήσεις - επιπλοκές,2085.00,7,297.86
Π05Χ,Μικρές επεμβάσεις λεπτού και παχέος εντέρου χωρίς συνυπάρχουσες παθήσεις - επιπλοκές,1379.00,4,344.75
Π06Α,Επεμβάσεις πυλορομυοτομής,1037.00,3,345.67
Π07Μ,Σκωληκοειδεκτομή με κακοήθεια ή περιτονίτιδα ή με καταστροφικές ή σοβαρές συνυπάρχουσες παθήσεις - επιπλοκές,1550.00,5,310.00
Π07Χ,Σκωληκοειδεκτομή χωρίς κακοήθεια ή περιτονίτιδα ή χωρίς καταστροφικές ή σοβαρές συνυπάρχουσες παθήσεις - επιπλοκές,983.00,2,491.50
Π10Μ,"Επεμβάσεις κηλών (βουβωνοκήλες, ομφαλοκήλες κτλ) με συνυπάρχουσες παθήσεις - επιπλοκές",1697.00,5,339.40
Π10Χ,"Επεμβάσεις κηλών (βουβωνοκήλες, ομφαλοκήλες κτλ) χωρίς συνυπάρχουσες παθήσεις - επιπλοκές",868.00,1,868.00
Π11Α,Επεμβάσεις που αφορούν κωλοστομίες και πρωκτό,566.00,2,283.00
Π12ΜΑ,Λοιπές Επεμβάσεις πεπτικού συστήματος με καταστροφικές συνυπάρχουσες παθήσεις - επιπλοκές,4177.00,16,261.06
Π12ΜΒ,Λοιπές Επεμβάσεις πεπτικού συστήματος με σοβαρές ή μεσαίας βαρύτητας συνυπάρχουσες παθήσεις - επιπλοκές,1932.00,7,276.00
Π12Χ,Λοιπές Επεμβάσεις πεπτικού συστήματος χωρίς συνυπάρχουσες παθήσεις - επιπλοκές,967.00,3,322.33
Π26Μ,Συνδυασμένη γαστροσκόπιση με καταστροφικές συνυπάρχουσες παθήσεις - επιπλοκές,3338.00,14,238.43
Π26Χ,Συνδυασμένη γαστροσκόπιση χωρίς καταστροφικές συνυπάρχουσες παθήσεις - επιπλοκές,1245.00,5,249.00
Π26Α,"Συνδυασμένη γαστροσκόπιση, την ίδια ημέρα",330.00,1,330.00
Π27Μ,Λοιπές επεμβάσεις γαστροσκόπισης με καταστροφικές συνυπάρχουσες παθήσεις - επιπλοκές,2521.00,12,210.08
Π27Χ,Λοιπές επεμβάσεις γαστροσκόπισης χωρίς καταστροφικές συνυπάρχουσες παθήσεις - επιπλοκές,988.00,4,247.00
Π27Α,"Λοιπές επεμβάσεις γαστροσκόπισης, την ίδια ημέρα",265.00,1,265.00
Π28Μ,Κολονοσκόπιση με καταστροφικές ή σοβαρές συνυπάρχουσες παθήσεις - επιπλοκές,2062.00,10,206.20
Π28Χ,Κολονοσκόπιση χωρίς καταστροφικές ή σοβαρές συνυπάρχουσες παθήσεις - επιπλοκές,872.00,4,218.00
Π28Α,"Κολονοσκόπιση, την ίδια ημέρα",290.00,1,290.00
Π40Μ,Κακοήθεια του γαστρεντερικού με καταστροφικές συνυπάρχουσες παθήσεις - επιπλοκές,1673.00,9,185.89
Π40Χ,Κακοήθεια του γαστρεντερικού χωρίς καταστροφικές συνυπάρχουσες παθήσεις - επιπλοκές,677.00,4,169.25
