ken_code,ken_description,basic_cost,mean_duration_days,extra_daily_cost
Δ11Α,"Άλλες χειρουργικές επεμβάσεις πλαστικής δέρματος, υποδορίου ιστού και μαστού",40400.0,1,40400.0
Δ12Μ,"Επεμβάσεις στα κάτω άκρα με έλκος/ κυτταρίτιδα, με καταστροφικές συνυπάρχουσες παθήσεις - επιπλοκές",487100.0,23,211780.0
Δ12ΧΑ,"Επεμβάσεις στα κάτω άκρα με έλκος/ κυτταρίτιδα, χωρίς καταστροφικές συνυπάρχουσες παθήσεις - επιπλοκές με επιδιόρθωση με δερματικό μόσχευμα ή μεταφορά δερματικού κρημνού",309700.0,13,238230.0
Δ12ΧΒ,Επεμβάσεις στα κάτω άκρα με έλκος/ κυτταρίτιδα χωρίς καταστροφικές συνυπάρχουσες παθήσεις - επιπλοκές χωρίς επιδιόρθωση με δερματικό μόσχευμα ή μεταφορά δερματικού κρημνού,177400.0,8,221750.0
Δ13Μ,Επεμβάσεις στα κάτω άκρα χωρίς έλκος/ κυτταρίτιδα με καταστροφικές συνυπάρχουσες παθήσεις - επιπλοκές ή με επιδιόρθωση με δερματικό μόσχευμα ή μεταφορά δερματικού κρημνού,285600.0,12,23800.0
Δ13Χ,"Επεμβάσεις στα κάτω άκρα χωρίς έλκος/ κυτταρίτιδα χωρίς καταστροφικές συνυπάρχουσες παθήσεις - επιπλοκές, χωρίς επιδιόρθωση με δερματικό μόσχευμα ή μεταφορά δερματικού κρημνού",91500.0,4,228750.0
Δ14Α,Εκτεταμένη πλαστική αποκατάσταση στήθους,419800.0,8,524750.0
Δ20Μ,Δερματικά έλκη με καταστροφικές συνυπάρχουσες παθήσεις - επιπλοκές,266900.0,16,166810.0
Δ20Χ,Δερματικά έλκη χωρίς καταστροφικές συνυπάρχουσες παθήσεις - επιπλοκές,147100.0,9,163440.0
Δ20Α,"Δερματικά έλκη, την ίδια ημέρα",17100.0,1,17100.0
Δ22Μ,κακοήθεις παθήσεις του μαστου με συνυπάρχουσες παθήσεις - επιπλοκές,96500.0,5,19300.0
Δ22Χ,κακοήθεις παθήσεις του μαστου χωρίς συνυπάρχουσες παθήσεις - επιπλοκές,68800.0,2,34400.0
Δ23Μ,μη-κακοήθεις παθήσεις του μαστου με συνυπάρχουσες παθήσεις - επιπλοκές,96500.0,5,19300.0
Δ23Χ,μη-κακοήθεις παθήσεις του μαστου χωρίς συνυπάρχουσες παθήσεις - επιπλοκές,36600.0,2,18300.0
Δ24Μ,Κυτταρίτιδα με καταστροφικές ή σοβαρές συνυπάρχουσες παθήσεις - επιπλοκές,161900.0,9,179890.0
Δ24Χ,Κυτταρίτιδα χωρίς καταστροφικές ή σοβαρές συνυπάρχουσες παθήσεις - επιπλοκές,80200.0,4,20050.0
Δ25Μ,"Τραύμα στο δέρμα , υποδορίου και του μαστού με καταστ. η σοβαρές συνυπάρχουσες παθήσεις - επιπλοκές",110500.0,6,184170.0
Δ25Χ,"Τραύμα στο δέρμα , υποδορίου και του μαστού χωρίς καταστ. η σοβαρές συνυπάρχουσες παθήσεις - επιπλοκές",35000.0,2,17500.0
Δ27Μ,Ελάσσονες παθήσεις του δέρματος,70800.0,3,23600.0
Δ27Χ,Ελάσσονες παθήσεις του δέρματος την ίδια ημέρα,19900.0,1,19900.0
Δ28Μ,Μείζονες παθήσεις με καταστροφικές η σοβαρές συνυπάρχουσες παθήσεις - επιπλοκές,196900.0,10,19690.0
Δ28Χ,Μείζονες παθήσεις χωρίς καταστροφικές η σοβαρές συνυπάρχουσες παθήσεις - επιπλοκές,96500.0,4,241250.0
Δ28Α,Μείζονες (μεγάλης βαρύτητας) παθήσεις την ίδια ημέρα,38200.0,1,38200.0
Δ29Μ,Κακοήθειες του δέρματος με καταστροφικές συνυπάρχουσες παθήσεις - επιπλοκές,217100.0,11,197360.0
Δ29Χ,Κακοήθειες του δέρματος χωρίς καταστροφικές συνυπάρχουσες παθήσεις - επιπλοκές,137700.0,7,196710.0
Δ29Α,Κακοήθειες του δέρματος την ίδια ημέρα,16100.0,1,16100.0
Θ01Μ,Διαβητικες επιπλοκές με καταστροφικές συνυπάρχουσες παθήσεις - επιπλοκές,620200.0,27,22970.0
Θ01Χ,Διαβητικες επιπλοκες χωρίς καταστροφικές συνυπάρχουσες παθήσεις - επιπλοκές,280100.0,12,233420.0
Θ02Μ,Επεμβάσεις υποφύσεως με συνυπάρχουσες παθήσεις - επιπλοκές,513500.0,10,51350.0
Θ02Χ,Επεμβάσεις υποφύσεως χωρίς συνυπάρχουσες παθήσεις - επιπλοκές,351500.0,6,585830.0
Θ03Α,Επεμβάσεις επινεφριδίου,329700.0,6,54950.0
Θ04Μ,Μείζονες ( εξαιρετικά βαριές ) Επεμβασεις για την Παχυσαρκια με συνυπάρχουσες παθήσεις - επιπλοκές,437800.0,8,547250.0
Θ04Χ,Μείζονες ( εξαιρετικά βαριές ) Επεμβασεις για την Παχυσαρκια χωρίς συνυπάρχουσες παθήσεις - επιπλοκές,284800.0,2,142400.0
Θ05Μ,Επεμβάσεις παραθυρεοειδών με καταστροφικές ή σοβαρές συνυπάρχουσες παθήσεις - επιπλοκές,258700.0,8,323380.0
Θ05Χ,Επεμβάσεις παραθυρεοειδών χωρίς καταστροφικές ή σοβαρές συνυπάρχουσες παθήσεις - επιπλοκές,121800.0,2,60900.0
Θ06Μ,Επεμβάσεις του θυρεοειδούς με καταστροφικές η σοβαρές συνυπάρχουσες παθήσεις - επιπλοκές,262000.0,5,52400.0
Θ06Χ,Επεμβάσεις του θυρεοειδούς χωρίς καταστροφικές η σοβαρές συνυπάρχουσες παθήσεις - επιπλοκές,158100.0,2,79050.0
Θ07Α,Επεμβάσεις για την παχυσαρκία,127600.0,3,425330.0
Θ08Α,Επεμβάσεις θυρεογλωσσικές,95200.0,1,95200.0
Θ09Μ,"Λοιπές χειρουργικές επεμβάσεις για ενδοκρινολογικές, διατροφικές και μεταβολικές διαταραχές με καταστροφικές συνυπάρχουσες παθήσεις - επιπλοκές",489500.0,19,257630.0
Θ09ΧΑ,"Λοιπές χειρουργικές επεμβάσεις για ενδοκρινολογικές, διατροφικές και μεταβολικές διαταραχές χωρίς καταστροφικές συνυπάρχουσες παθήσεις - επιπλοκές",208000.0,7,297140.0
Θ09ΧΒ,"Άλλες Ενδοκρινολογικές, θρεπτικών και μεταβολικές επεμβάσεις χωρίς σοβαρές και μετριοπαθή συνυπάρχουσες παθήσεις - επιπλοκές",176500.0,3,588330.0
Θ20Μ,Ενδοσκοπικές ή διερευνητικές επεμβάσεις για μεταβολικές δυσλειτουργίες με καταστροφικές συνυπάρχουσες παθήσεις - επιπλοκές,429600.0,18,238670.0
Θ20Χ,Ενδοσκοπικές ή διερευνητικές επεμβάσεις για μεταβολικές δυσλειτουργίες χωρίς καταστροφικές συνυπάρχουσες παθήσεις - επιπλοκές,158000.0,7,225710.0
Θ20Α,Ενδοσκοπικές ή διερευνητικές επεμβάσεις για μεταβολικές δυσλειτουργίες την ίδια ημέρα,29700.0,1,29700.0
Θ21Α,Σοβαρές διατροφικές διαταραχές,259900.0,12,216580.0
Θ22Μ,Διάφορες δυσλειτουργίες του μεταβολισμού με καταστροφικές ή σοβαρές συνυπάρχουσες παθήσεις - επιπλοκές,139300.0,7,19900.0
Θ22Χ,Διάφορες δυσλειτουργίες του μεταβολισμού χωρίς καταστροφικές ή σοβαρές συνυπάρχουσες παθήσεις - επιπλοκές,48200.0,2,24100.0
Θ23Μ,Συγγενή ασθένειες του μεταβολισμού με συνυπάρχουσες παθήσεις - επιπλοκές,107400.0,4,26850.0
Θ23Χ,Συγγενή ασθένειες του μεταβολισμού χωρίς συνυπάρχουσες παθήσεις - επιπλοκές,40500.0,2,20250.0
Θ24Μ,Ενδοκρινολογικές δυσλειτουργίες με καταστροφικές η σοβαρές συνυπάρχουσες παθήσεις - επιπλοκές,182900.0,9,203220.0
Θ24Χ,Ενδοκρινολογικές δυσλειτουργίες χωρίς καταστροφικές η σοβαρές συνυπάρχουσες παθήσεις - επιπλοκές,66900.0,2,33450.0
Υ02Μ,Επέμβαση τοποθέτησης εισαγωγής καθετήρα περιτοναϊκής κάθαρσης με καταστροφικές ή σοβαρές συνυπάρχουσες παθήσεις – επιπλοκές,311100.0,10,31110.0
Υ02Χ,Επέμβαση τοποθέτησης εισαγωγής καθετήρα περιτοναϊκής κάθαρσης χωρίς καταστροφικές ή σοβαρές συνυπάρχουσες παθήσεις – επιπλοκές,118900.0,2,59450.0
Υ03ΜΑ,"Επεμβάσεις νεφρού, ουρητήρα και μεγάλες επεμβάσεις ουροδόχου κύστης για νεοπλασία με καταστροφικές συνυπάρχουσες παθήσεις – επιπλοκές",643100.0,15,428730.0
Υ03ΜΒ,"Επεμβάσεις νεφρού, ουρητήρα και μεγάλες επεμβάσεις ουροδόχου κύστης για νεοπλασία με σοβαρές συνυπάρχουσες παθήσεις – επιπλοκές",442600.0,9,491780.0
Υ03Χ,"Επεμβάσεις νεφρού, ουρητήρα και μεγάλες επεμβάσεις ουροδόχου κύστης για νεοπλασία χωρίς καταστροφικές ή σοβαρές συνυπάρχουσες παθήσεις – επιπλοκές",299200.0,5,59840.0
Υ04Μ,"Επεμβάσεις νεφρού, ουρητήρα και μεγάλες επεμβάσεις ουροδόχου κύστης για μη-νεοπλασία με καταστροφικές συνυπάρχουσες παθήσεις – επιπλοκές",435500.0,15,290330.0
Υ04ΧΑ,"Επεμβάσεις νεφρού, ουρητήρα και μεγάλες επεμβάσεις ουροδόχου κύστης για μη-νεοπλασία με σοβαρές συνυπάρχουσες παθήσεις – επιπλοκές",236100.0,7,337290.0
Υ04ΧΒ,"Επεμβάσεις νεφρού, ουρητήρα και μεγάλες επεμβάσεις ουροδόχου κύστης για μη-νεοπλασία χωρίς καταστροφικές ή σοβαρές συνυπάρχουσες παθήσεις – επιπλοκές",160500.0,3,53500.0
Υ05Μ,Διουρηθρική προστατεκτομή με καταστροφικές ή σοβαρές συνυπάρχουσες παθήσεις – επιπλοκές,284800.0,11,258910.0
Υ05Χ,Διουρηθρική προστατεκτομή χωρίς καταστροφικές ή σοβαρές συνυπάρχουσες παθήσεις – επιπλοκές,100000.0,3,333330.0
Υ06Μ,Μικρές επεμβάσεις Ουροδοχου κυστεως με καταστροφικές ή σοβαρές συνυπάρχουσες παθήσεις – επιπλοκές,238100.0,9,264560.0
Υ06Χ,Μικρές επεμβάσεις Ουροδοχου κυστεως χωρίς καταστροφικές ή σοβαρές συνυπάρχουσες παθήσεις – επιπλοκές,80800.0,2,40400.0
Υ07Μ,Διουρηθρικές επεμβάσεις εκτός προστατεκτομικές με καταστροφικές ή σοβαρές συνυπάρχουσες παθήσεις – επιπλοκές,121800.0,5,24360.0
Υ07Χ,Διουρηθρικές επεμβάσεις εκτός προστατεκτομικές χωρίς καταστροφικές ή σοβαρές συνυπάρχουσες παθήσεις – επιπλοκές,68000.0,1,68000.0
Υ08Μ,Επεμβάσεις ουρήθρας με συνυπάρχουσες παθήσεις – επιπλοκές,127100.0,5,25420.0
Υ08Χ,Επεμβάσεις ουρήθρας χωρίς συνυπάρχουσες παθήσεις – επιπλοκές,63100.0,2,31550.0
Υ09Μ,Άλλες επεμβάσεις για δυσλειτουργία νεφρού και ουροποιητικού συστήματος με καταστροφικές ή σοβαρές συνυπάρχουσες παθήσεις – επιπλοκές,472900.0,17,278180.0
Υ09ΧΑ,Άλλες επεμβάσεις για δυσλειτουργία νεφρού και ουροποιητικού συστήματος χωρίς καταστροφικές ή σοβαρές συνυπάρχουσες παθήσεις – επιπλοκές,191900.0,4,479750.0
Υ09ΧΒ,Άλλες επεμβάσεις στα νεφρά και το ουροποιητικό σύστημα χωρίς καταστροφικές συνυπάρχουσες παθήσεις - επιπλοκές,103500.0,2,51750.0
Υ20Α,Ουρηθροσκόπηση,76700.0,2,38350.0
Υ21Α,Ουρηθροσκόπηση σε μία ημέρα,23100.0,1,23100.0
Υ22Α,Εξωσωματική λιθοτριψία για λίθους του ουροποιητικού,48200.0,1,48200.0
Υ20ΜΑ,Νεφρική ανεπάρκεια με καταστροφικές συνυπάρχουσες παθήσεις – επιπλοκές,293400.0,12,24450.0
Υ20ΜΒ,Νεφρική ανεπάρκεια με σοβαρές συνυπάρχουσες παθήσεις – επιπλοκές,130000.0,6,216670.0
Υ20Χ,Νεφρική ανεπάρκεια χωρίς καταστροφικές ή σοβαρές συνυπάρχουσες παθήσεις – επιπλοκές,58400.0,3,194670.0
Υ22Μ,Νεοπλάσματα νεφρού και ουροποιητικού με καταστροφικές ή σοβαρές συνυπάρχουσες παθήσεις – επιπλοκές,147100.0,7,210140.0
Υ22Χ,Νεοπλάσματα νεφρού και ουροποιητικού χωρίς καταστροφικές ή σοβαρές συνυπάρχουσες παθήσεις – επιπλοκές,54500.0,2,27250.0
Υ23Μ,Λοιμώξεις νεφρού και ουροποιητικού με καταστροφικές ή σοβαρές συνυπάρχουσες παθήσεις – επιπλοκές,156400.0,8,19550.0
Υ23Χ,Λοιμώξεις νεφρού και ουροποιητικού χωρίς καταστροφικές ή σοβαρές συνυπάρχουσες παθήσεις – επιπλοκές,56000.0,3,186670.0
Υ24Α,Λιθίαση ουροποιητικού και απόφραξη,38900.0,2,19450.0
Υ25Μ,Συμπτώματα και σημεία των νεφρών και του ουροποιητικού συστήματος με καταστροφικές ή σοβαρές συνυπάρχουσες παθήσεις - επιπλοκές,112800.0,6,18800.0
Υ25Χ,Συμπτώματα και σημεία των νεφρών και του ουροποιητικού συστήματος χωρίς καταστροφικές ή σοβαρές συνυπάρχουσες παθήσεις - επιπλοκές,40500.0,2,20250.0
Υ26Α,Στενώματα ουρήθρας,44000.0,2,22000.0
Υ27Μ,Λοιπές διαγνώσεις των νεφρών και του ουροποιητικού συστήματος με καταστροφικές ή σοβαρές συνυπάρχουσες παθήσεις - επιπλοκές,167300.0,7,23900.0
Υ27Χ,Λοιπές διαγνώσεις των νεφρών και του ουροποιητικού συστήματος χωρίς καταστροφικές ή σοβαρές συνυπάρχουσες παθήσεις - επιπλοκές,35800.0,2,17900.0
Υ28Α,Περιτοναϊκή κάθαρση,29600.0,1,29600.0
Β01Μ,Μείζονες ανδρικές πυελικές επεμβάσεις με καταστροφικές ή σοβαρές συνυπάρχουσες παθήσεις – επιπλοκές,355300.0,8,444120.0
Β01Χ,Μείζονες ανδρικές πυελικές επεμβάσεις χωρίς καταστροφικές ή σοβαρές συνυπάρχουσες παθήσεις – επιπλοκές,289200.0,4,72300.0
Β02Μ,Διουρηθρική προστατεκτομή με καταστροφικές ή σοβαρές συνυπάρχουσες επιπλοκές,171900.0,7,245570.0
Β02Χ,Διουρηθρική προστατεκτομή χωρίς καταστροφικές ή σοβαρές συνυπάρχουσες επιπλοκές,100700.0,3,335670.0
Β03Α,Επεμβάσεις Πέους,77100.0,2,38550.0
Β04Α,Επεμβάσεις όρχεων,65200.0,1,65200.0
Β05Α,Περιτομή,45800.0,1,45800.0
Β06Μ,Λοιπές χειρουργικές επεμβάσεις αντρικού αναπαραγωγικού συστήματος με καταστροφικές συνυπάρχουσες παθήσεις - επιπλοκές,193000.0,6,321670.0
Β06Χ,Λοιπές χειρουργικές επεμβάσεις αντρικού αναπαραγωγικού συστήματος χωρίς καταστροφικές συνυπάρχουσες παθήσεις - επιπλοκές,165900.0,2,82950.0
Β10Α,"Κυστεοσκόπηση, την ίδια ημέρα",22000.0,1,22000.0
Β20Μ,Κακοήθεια του αντρικού αναπαραγωγικού συστήματος με καταστροφικές ή σοβαρές συνυπάρχουσες παθήσεις - επιπλοκές,132300.0,7,18900.0
Β20Χ,Κακοήθεια του αντρικού αναπαραγωγικού συστήματος χωρίς καταστροφικές ή σοβαρές συνυπάρχουσες παθήσεις - επιπλοκές,41300.0,2,20650.0
Β21Α,Καλοήθης υπερτροφία προστάτη,45900.0,2,22950.0
Β22Α,Φλεγμονή του αντρικού αναπαραγωγικού συστήματος,54500.0,3,181670.0
Β23Α,Αντρική στείρωση,31600.0,1,31600.0
Β24Α,Άλλη διάγνωση αντρικού αναπαραγωγικού συστήματος,29600.0,1,29600.0
Γ01Α,Πυελική εξπλάχνιση και ριζική βουλβεκτομή,296400.0,8,37050.0
Γ04Μ,Υστερεκτομή για μη κακοήθεια με καταστροφικές ή σοβαρές συνυπάρχουσες παθήσεις - επιπλοκές,206200.0,5,41240.0
Γ04Χ,Υστερεκτομή για μη κακοήθεια χωρίς καταστροφικές ή σοβαρές συνυπάρχουσες παθήσεις - επιπλοκές,152500.0,3,508330.0
Γ05Μ,Χειρουργική αφαίρεση ωοθηκών και σαλπίγγων για μη κακοήθεια με καταστροφικές ή σοβαρές συνυπάρχουσες παθήσεις - επιπλοκές,214700.0,6,357830.0
Γ05Χ,Χειρουργική αφαίρεση ωοθηκών και σαλπίγγων για μη κακοήθεια χωρίς καταστροφικές ή σοβαρές συνυπάρχουσες παθήσεις - επιπλοκές,137400.0,2,68700.0
Γ06Μ,Επανορθωτική επέμβαση γυναικείου αναπαραγωγικού συστήματος με καταστροφικές ή σοβαρές συνυπάρχουσες παθήσεις - επιπλοκές,164900.0,4,412250.0
Γ06Χ,Επανορθωτική επέμβαση γυναικείου αναπαραγωγικού συστήματος χωρίς καταστροφικές ή σοβαρές συνυπάρχουσες παθήσεις - επιπλοκές,126400.0,2,63200.0
Γ07Α,Λοιπές επεμβάσεις μήτρας και εξαρτημάτων για μη κακοήθεια,74200.0,1,74200.0
Γ08Α,Ενδοσκοπικές και λαπαροσκοπικές Επεμβάσεις στο γυναικείο αναπαραγωγικό σύστημα,71900.0,1,71900.0
Γ09Α,"Επεμβάσεις αΐδιου, τραχήλου και κόλπου",41800.0,2,20900.0
Γ10Α,Διαγνωστική υστεροσκόπηση απόξεση,42500.0,1,42500.0
Γ11Α,Άλλες επεμβάσεις στο γυναικείο αναπαραγωγικό σύστημα,72900.0,3,24300.0
Γ12Μ,Επέμβαση για κακοήθεια μήτρας και δευτερευόντων οργάνων με καταστροφικές συνυπάρχουσες παθήσεις - επιπλοκές,357600.0,9,397330.0
Γ12Χ,Επέμβαση για κακοήθεια μήτρας και δευτερευόντων οργάνων χωρίς καταστροφικές συνυπάρχουσες παθήσεις - επιπλοκές,196300.0,4,490750.0
Γ20Μ,Κακοήθεια γυναικείου αναπαραγωγικού συστήματος με καταστροφικές συνυπάρχουσες παθήσεις - επιπλοκές,196900.0,9,218780.0
Γ20Χ,Κακοήθεια γυναικείου αναπαραγωγικού συστήματος χωρίς καταστροφικές συνυπάρχουσες παθήσεις - επιπλοκές,75500.0,3,251670.0
Γ21Α,Λοιμώξεις του γυναικείου αναπαραγωγικού συστήματος,47500.0,2,23750.0
Γ22Α,Διαταραχές εμμήνου ρύσεως και άλλες διαταραχές του γυναικείου αναπαραγωγικού συστήματος,25700.0,1,25700.0
Λ01Μ,Τοκετός με καισαρική τομή με καταστροφικές ή σοβαρές συνυπάρχουσες παθήσεις - επιπλοκές,217100.0,7,310140.0
Λ01Χ,Τοκετός με καισαρική τομή χωρίς καταστροφικές ή σοβαρές συνυπάρχουσες παθήσεις - επιπλοκές,154100.0,4,385250.0
Λ02Μ,Κολπικός τοκετός με παρέμβαση στο χειρουργείο με καταστροφικές ή σοβαρές συνυπάρχουσες παθήσεις - επιπλοκές,174300.0,4,435750.0
Λ02Χ,Κολπικός τοκετός με επέμβαση στο χειρουργείο χωρίς καταστροφικές ή σοβαρές συνυπάρχουσες παθήσεις - επιπλοκές,117500.0,3,391670.0
Λ03Μ,Έκτοπη κύηση με καταστροφικές συνυπάρχουσες παθήσεις - επιπλοκές,124900.0,3,416330.0
Λ03Χ,Έκτοπη κύηση χωρίς καταστροφικές συνυπάρχουσες παθήσεις - επιπλοκές,88600.0,2,44300.0
Λ04Μ,Επέμβαση στο χειρουργείο μετά τον τοκετό ή μετά την άμβλωση με καταστροφικές ή σοβαρές συνυπάρχουσες παθήσεις - επιπλοκές,180700.0,5,36140.0
Λ04Χ,Επέμβαση σο χειρουργείο μετά τον τοκετό ή μετά την άμβλωση χωρίς καταστροφικές ή σοβαρές συνυπάρχουσες παθήσεις - επιπλοκές,57100.0,2,28550.0
Λ05Α,Άμβλωση με χειρουργική επέμβαση,33400.0,1,33400.0
Λ20Α,Κολπικός τοκετός,87200.0,3,290670.0
Λ21Α,Μετά τοκετός άμβλωση χωρίς χειρουργική επέμβαση,42000.0,2,21000.0
Λ23Α,Άμβλωση χωρίς επέμβαση στο χειρουργείο,26500.0,1,26500.0
Λ24Α,Αποβολή,28800.0,2,14400.0
Λ26Α,Προγεννητική και άλλη μαιευτική εισαγωγή,25700.0,2,12850.0
Τ02Α,Καρδιοθωρακική / αγγειοχειρουργική επέμβαση σε νεογνά,2027900.0,23,88170.0
Ξ01Α,Σπληνεκτομή,347600.0,7,496570.0
Ξ02Μ,Λοιπές χειρουργικές επεμβάσεις αίματος και αιμοποιητικών οργάνων με καταστροφικές ή σοβαρές συνυπάρχουσες παθήσεις - επιπλοκές,465500.0,13,358080.0
Ξ02Χ,Λοιπές χειρουργικές επεμβάσεις αίματος και αιμοποιητικών οργάνων χωρίς καταστροφικές ή σοβαρές συνυπάρχουσες παθήσεις - επιπλοκές,78100.0,2,39050.0
