ken_code,ken_description,basic_cost,mean_duration_days,extra_daily_cost
Π41Μ,Αιμορραγία γαστρεντερικού με καταστροφικές ή σοβαρές συνυπάρχουσες παθήσεις - επιπλοκές,1027.00,5,205.40
Π41Χ,Αιμορραγία γαστρεντερικού χωρίς καταστροφικές ή σοβαρές συνυπάρχουσες παθήσεις - επιπλοκές,412.00,2,206.00
Π42Α,Επιπεπλεγμένο πεπτικό έλκος,1097.00,5,219.40
Π43Α,Μη επιπεπλεγμένο πετικό έλκος,335.00,2,167.50
Π44Μ,Φλεγμονώδης νόσος εντέρου με συνυπάρχουσες παθήσεις - επιπλοκές,1097.00,5,219.40
Π44Χ,Φλεγμονώδης νόσος εντέρου χωρίς συνυπάρχουσες παθήσεις - επιπλοκές,1073.00,2,536.50
Π45Μ,Απόφραξη γαστρεντερικού συστήματος με καταστροφικές ή σοβαρές συνυπάρχουσες παθήσεις - επιπλοκές,1338.00,7,191.14
Π45Χ,Απόφραξη γαστρεντερικού συστήματος χωρίς καταστροφικές ή σοβαρές συνυπάρχουσες παθήσεις - επιπλοκές,623.00,3,207.67
Π46Α,Κοιλιακός πόνος ή μεσεντερική αδενίτιδα,327.00,2,163.50
Π47Μ,Οισοφαγίτιδα και γαστρεντερίτιδα με καταστροφικές ή σοβαρές συνυπάρχουσες παθήσεις - επιπλοκές,1121.00,5,224.20
Π47Χ,Οισοφαγίτιδα και γαστρεντερίτιδα χωρίς καταστροφικές ή σοβαρές συνυπάρχουσες παθήσεις - επιπλοκές,335.00,2,167.50
Π50Μ,Διάγνωση άλλων παθήσεων του πεπτικού συστήματος με καταστροφικές ή σοβαρές συνυπάρχουσες παθήσεις - επιπλοκές,1136.00,6,189.33
Π50Χ,Διάγνωση άλλων παθήσεων του πεπτικού συστήματος χωρίς καταστροφικές ή σοβαρές συνυπάρχουσες παθήσεις - επιπλοκές,374.00,2,187.00
Η01Μ,"Αναστομώσεις πυλαίας-κάτω κοίλης, επεμβάσεις παγκρέατος, ήπατος και παρακάμψεις με καταστροφικές συνυπάρχουσες παθήσεις - επιπλοκές",7916.00,19,416.63
Η01Χ,"Αναστομώσεις πυλαίας-κάτω κοίλης, επεμβάσεις παγκρέατος, ήπατος και παρακάμψεις χωρίς καταστροφικές συνυπάρχουσες παθήσεις - επιπλοκές",3682.00,7,526.00
Η02ΜΑ,Μείζονες επεμβάσεις χοληφόρων με καταστροφικές συνυπάρχουσες παθήσεις - επιπλοκές,5111.00,17,300.65
Η02ΜΒ,Μείζονες επεμβάσεις χοληφόρων με σοβαρές συνυπάρχουσες παθήσεις - επιπλοκές,2578.00,9,286.44
Η02Χ,Μείζονες επεμβάσεις χοληφόρων χωρίς καταστροφικές ή σοβαρές συνυπάρχουσες παθήσεις - επιπλοκές,2079.00,6,346.50
Η05Μ,Διαγνωστικές ηπατοχολικές παρεμβάσεις με καταστροφικές συνυπάρχουσες παθήσεις - επιπλοκές,4533.00,14,323.79
Η05Χ,Διαγνωστικές ηπατοχολικέςπαρεμβάσεις χωρίς καταστροφικές συνυπάρχουσες παθήσεις - επιπλοκές,1393.00,4,348.25
Η06Μ,Λοιπές Διαγνωστικές ηπατοχολικές χειρουργικές παρεμβάσεις και παρεμβάσεις παγκρέατος με καταστροφικές συνυπάρχουσες παθήσεις - επιπλοκές,4646.00,19,244.53
Η06Χ,Λοιπές Διαγνωστικές ηπατοχολικές χειρουργικές παρεμβάσεις και παρεμβάσεις παγκρέατος χωρίς καταστροφικές συνυπάρχουσες παθήσεις - επιπλοκές,1556.00,5,311.20
Η07Μ,Ανοιχτή χολοκυστεκτομή με κλειστό χοληδόχο πόρο ή με καταστροφικές συνυπάρχουσες παθήσεις - επιπλοκές,4299.00,14,307.07
Η07Χ,Ανοιχτή χολοκυστεκτομή χωρίς κλειστό χοληδόχο πόρο χωρίς καταστροφικές συνυπάρχουσες παθήσεις - επιπλοκές,2037.00,6,339.50
Η08Μ,Λαπαρασκοπική χολοκυστεκτομή με κλειστό χοληδόχο πόρο ή με καταστροφικές ή σοβαρές συνυπάρχουσες παθήσεις - επιπλοκές,2111.00,6,351.83
Η08Χ,Λαπαρασκοπική χολοκυστεκτομή χωρίς κλειστό χοληδόχο πόρο χωρίς καταστροφικές ή σοβαρές συνυπάρχουσες παθήσεις - επιπλοκές,1273.00,2,636.50
Η20Μ,Ενδοσκοπικές επεμβάσεις για αιμορραγία κιρσων του οισοφάγου με καταστροφικές συνυπάρχουσες παθήσεις - επιπλοκές,3561.00,11,323.73
Η20Χ,Ενδοσκοπικές επεμβάσεις για αιμορραγία κιρσων του οισοφάγου χωρίς καταστροφικές συνυπάρχουσες παθήσεις - επιπλοκές,1517.00,5,303.40
Η23Μ,Ενδοσκοπική παλίνδρομη χολαγειοπαγκρεατογραφία με καταστροφικές ή σοβαρές συνυπάρχουσες παθήσεις - επιπλοκές,2552.00,11,232.00
Η23Χ,Ενδοσκοπική παλίνδρομη χολαγειοπαγκρεατογραφία χωρίς καταστροφικές ή σοβαρές συνυπάρχουσες παθήσεις - επιπλοκές,786.00,3,262.00
Η40ΜΑ,Κίρρωση και αλκοολική ηπατίτιδα με καταστροφικές συνυπάρχουσες παθήσεις - επιπλοκές,2654.00,12,221.17
Η40ΜΒ,Κίρρωση και αλκοολική ηπατίτιδα με σοβαρές ή μεσαίας βαρύτητας συνυπάρχουσες παθήσεις - επιπλοκές,965.00,5,193.00
Η40Χ,Κίρρωση και αλκοολική ηπατίτιδα χωρίς συνυπάρχουσες παθήσεις - επιπλοκές,366.00,2,183.00
Η41Μ,Κακοήθεια του ηπατοχολικού συστήματος και παγκρέατος με καταστροφικές συνυπάρχουσες παθήσεις - επιπλοκές,1930.00,9,214.44
Η41Χ,Κακοήθεια του ηπατοχολικού συστήματος και παγκρέατος χωρίς καταστροφικές συνυπάρχουσες παθήσεις - επιπλοκές,872.00,4,218.00
Η42Μ,Διαταραχές παγκρέατος χωρίς κακοήθεια με καταστροφικές ή σοβαρές συνυπάρχουσες παθήσεις - επιπλοκές,1938.00,8,242.25
Η42Χ,Διαταραχές παγκρέατος χωρίς κακοήθεια χωρίς καταστροφικές ή σοβαρές συνυπάρχουσες παθήσεις - επιπλοκές,708.00,3,236.00
Η43Μ,"Διαταραχές ήπατος χωρίς κακοήθεια, Κύρωση, αλκοολική ηπατίτιδα με καταστροφικές ή σοβαρές συνυπάρχουσες παθήσεις - επιπλοκές",1813.00,8,226.62
Η43Χ,"Διαταραχές ήπατος χωρίς κακοήθεια, Κύρωση, αλκοολική ηπατίτιδα χωρίς καταστροφικές ή σοβαρές συνυπάρχουσες παθήσεις - επιπλοκές",521.00,2,260.50
Η44Μ,Δαταραχές των χοληφόρων με συνυπάρχουσες παθήσεις - επιπλοκές,1198.00,6,199.67
Η44Χ,Δαταραχές των χοληφόρων με/ χωρίς συνυπάρχουσες παθήσεις - επιπλοκές,436.00,2,218.00
Μ01Μ,Αμφοτερόπλευρες/Πολλαπλές επεμβάσεις μεγάλων αρθρώσεων κάτω άκρων με αναθεώρηση ή με καταστροφικές συνυπάρχουσες παθήσεις - επιπλοκές,14020.00,25,560.80
Μ01Χ,Αμφοτερόπλευρες/ Πολλαπλές επεμβάσεις μεγάλων αρθρώσεων κάτω άκρων χωρίς αναθεώρηση χωρίς καταστροφικές συνυπάρχουσες παθήσεις - επιπλοκές,9606.00,7,1372.29
Μ02Μ,Μεταφορά μικροαγγειούμενου ιστικού μοσχεύματος ή (Δερματικό μόσχευμα με καταστροφικές ή σοβαρές συνυπάρχουσες παθήσεις – επιπλοκές) εξαιρουμένης άκρας χείρας,9110.00,27,337.41
Μ02Χ,"Δερματικό μόσχευμα (κρημνός) χωρίς καταστροφικές ή σοβαρές συνυπάρχουσες παθήσεις – επιπλοκές, εξαιρουμένης άκρας χείρας",3430.00,8,428.75
Μ03Μ,Αντικατάσταση ισχίου με καταστροφικές συνυπάρχουσες παθήσεις - επιπλοκές,6307.00,15,420.47
Μ03Χ,Αντικατάσταση ισχίου χωρίς καταστροφικές συνυπάρχουσες παθήσεις - επιπλοκές,6411.00,7,915.86
Μ04Μ,Αντικατάσταση γόνατος με καταστροφικές ή σοβαρές συνυπάρχουσες παθήσεις - επιπλοκές,7042.00,9,782.44
Μ04Χ,Αντικατάσταση γόνατος χωρίς καταστροφικές ή σοβαρές συνυπάρχουσες παθήσεις - επιπλοκές,6611.00,6,1101.83
Μ05Μ,Αντικατάσταση άλλων αρθρώσεων με καταστροφικές ή σοβαρές συνυπάρχουσες παθήσεις - επιπλοκές,7705.00,11,700.45
Μ05Χ,Αντικατάσταση άλλων αρθρώσεων χωρίς καταστροφικές ή σοβαρές συνυπάρχουσες παθήσεις - επιπλοκές,6101.00,5,1220.20
Μ06Α,Σπονδυλοδεσία με παραμόρφωση,19980.00,9,2220.00
Μ07Α,Ακρωτηριασμός,5235.00,21,249.29
Μ08Μ,Λοιπές επεμβάσεις ισχίου και μηριαίου με καταστροφικές συνυπάρχουσες παθήσεις - επιπλοκές,4449.00,17,261.71
Μ08Χ,Λοιπές επεμβάσεις ισχίου και μηριαίου χωρίς καταστροφικές συνυπάρχουσες παθήσεις - επιπλοκές,3014.00,9,334.89
Μ09Μ,Σπονδυλοδεσία με καταστροφικές συνυπάρχουσες παθήσεις - επιπλοκές,14720.00,18,817.78
Μ09Χ,Σπονδυλοδεσία χωρίς καταστροφικές συνυπάρχουσες παθήσεις - επιπλοκές,9783.00,7,1397.57
Μ10Μ,Λοιπές επεμβάσεις αυχένος-οσφύος - θώρακος με καταστροφικές ή σοβαρές συνυπάρχουσες παθήσεις - επιπλοκές,3391.00,10,339.10
Μ10Χ,Λοιπές επεμβάσεις αυχένος-οσφύος - θώρακος χωρίς καταστροφικές ή σοβαρές συνυπάρχουσες παθήσεις - επιπλοκές,1908.00,4,477.00
Μ11Α,Επεμβάσεις διατατικής επιμηκύνσεως άκρων,4045.00,4,1011.25
Μ12ΜΑ,Λοίμωξη / φλεγμονή οστών και αρθρώσεων με διάφορες μυοσκελετικές επεμβάσεις με σοβαρής και μέτριας βαρύτητας συνυπάρχουσες παθήσεις - επιπλοκές,5478.00,24,228.25
Μ12ΜΒ,Λοίμωξη / φλεγμονή οστών και αρθρώσεων με διάφορες μυοσκελετικές επεμβάσεις με καταστροφικές συνυπάρχουσες παθήσεις - επιπλοκές,2993.00,14,213.79
Μ12Χ,Λοίμωξη / φλεγμονή οστών και αρθρώσεων με διάφορες μυοσκελετικές επεμβάσεις χωρίς συνυπάρχουσες παθήσεις - επιπλοκές,1665.00,6,277.50
Μ13Μ,"Επεμβάσεις βραχιονίου, κνήμης, περόνης και αστραγάλου με συνυπάρχουσες παθήσεις - επιπλοκές",3893.00,11,353.91
Μ13Χ,"Επεμβάσεις Βραχιονίου, κνήμης, περόνης και αστραγάλου χωρίς συνυπάρχουσες παθήσεις - επιπλοκές",2083.00,4,520.75
Μ15Α,Κρανιοπροσωπικές επεμβάσεις,3761.00,6,626.83
Μ16Α,Λοιπές επεμβάσεις ώμου,1588.00,2,794.00
Μ17Μ,Γναθοπροσωπικές επεμβάσεις με συνυπάρχουσες παθήσεις - επιπλοκές,2708.00,3,902.67
Μ17Χ,Γναθοπροσωπικές επεμβάσεις χωρίς συνυπάρχουσες παθήσεις - επιπλοκές,1764.00,2,882.00
Μ18Α,Λοιπές επεμβάσεις γόνατος,743.00,1,743.00
Μ19Μ,Λοιπές επεμβάσεις αγκώνος και αντιβραχίου με συνυπάρχουσες παθήσεις - επιπλοκές,2648.00,6,441.33
Μ19Χ,Λοιπές επεμβάσεις αγκώνος και αντιβραχίου χωρίς συνυπάρχουσες παθήσεις - επιπλοκές,1904.00,2,952.00
Μ20Α,Λοιπές επεμβάσεις άκρου ποδός,1286.00,2,643.00
Μ21Α,Τοπική Εκτομή και Αφαίρεση υλικών εσωτερικής οστεοσύνθεσης ισχίου και μηριαίου,1052.00,2,526.00
Μ23Α,Τοπική εκτομή και αφαίρεση υλικών εσωτερικής οστεοσύνθεσης εκτός ισχίου και μηριαίου,661.00,1,661.00
Μ24Α,Αρθροσκόπηση,710.00,1,710.00
Μ25Μ,Διαγνωστικές επεμβάσεις οστών και αρθρώσεων συμπεριλαμβανομένης βιοψίας με συνυπάρχουσες παθήσεις - επιπλοκές,2864.00,11,260.36
Μ25Χ,Διαγνωστικές επεμβάσεις οστών και αρθρώσεων συμπεριλαμβανομένης βιοψίας χωρίς συνυπάρχουσες παθήσεις - επιπλοκές,1260.00,3,420.00
Μ27Μ,Επεμβάσεις μαλακών μορίων με συνυπάρχουσες παθήσεις - επιπλοκές,2179.00,9,242.11
Μ27Χ,Επεμβάσεις μαλακών μορίων χωρίς συνυπάρχουσες παθήσεις - επιπλοκές,902.00,2,451.00
Μ28Μ,Λοιπές επεμβάσεις μυοσκελετικού με συνυπάρχουσες παθήσεις - επιπλοκές,2639.00,11,239.91
Μ28Χ,Λοιπές επεμβάσεις μυοσκελετικού χωρίς συνυπάρχουσες παθήσεις - επιπλοκές,1379.00,2,689.50
Μ29Α,Ανακατασκευή ή αναθεώρηση πρόθεσης γόνατος,1903.00,1,1903.00
Μ30Α,Επεμβάσεις χειρός,891.00,1,891.00
Μ31Μ,Επανεπεμβαση Ισχίου με καταστροφικές συνυπάρχουσες παθήσεις - επιπλοκές,11675.00,23,507.61
Μ31Χ,Επανεπεμβαση Ισχίου χωρίς καταστροφικές συνυπάρχουσες παθήσεις - επιπλοκές,8533.00,11,775.73
Μ32ΜΑ,Επανεπεμβαση γόνατος με καταστροφικές συνυπάρχουσες παθήσεις - επιπλοκές,12912.00,27,478.22
Μ32ΜΒ,Επανεπεμβαση γόνατος με συνυπάρχουσες παθήσεις - επιπλοκές,9963.00,12,830.25
Μ32Χ,Επανεπεμβαση γόνατος χωρίς καταστροφικές η συνυπάρχουσες παθήσεις - επιπλοκές,9147.00,9,1016.33
Μ60Α,Κατάγματα διάφυσης μηριαίου,1720.00,7,245.71
Μ61Μ,Κατάγματα περιφερικού μηριαίου με συνυπάρχουσες παθήσεις - επιπλοκές,2210.00,13,170.00
Μ61Χ,Κατάγματα περιφερικού μηριαίου χωρίς συνυπάρχουσες παθήσεις - επιπλοκές,856.00,4,214.00
Μ63Μ,"Θλάσεις, διαστρέμματα και εξαρθρώματα Ισχίου, Λεκάνης και Μηρού με συνυπάρχουσες παθήσεις - επιπλοκές",1198.00,7,171.14
Μ63Χ,"Θλάσεις, διαστρέμματα και εξαρθρώματα Ισχίου, Λεκάνης και Μηρού χωρίς συνυπάρχουσες παθήσεις - επιπλοκές",444.00,2,222.00
Μ64Μ,Οστεομυελίτιδα με καταστροφικές ή σοβαρές συνυπάρχουσες παθήσεις - επιπλοκές,2669.00,15,177.93
Μ64Χ,Οστεομυελίτιδα χωρίς καταστροφικές ή σοβαρές συνυπάρχουσες παθήσεις - επιπλοκές,1175.00,8,146.88
Μ65Μ,Κακοήθεις νεοπλασματικοί όγκοι μυοσκελετικού με καταστροφικές συνυπάρχουσες παθήσεις-επιπλοκές,2560.00,12,213.33
Μ65Χ,Κακοήθεις νεοπλασματικοί όγκοι μυοσκελετικού χωρίς καταστροφικές συνυπάρχουσες παθήσεις-επιπλοκές,1222.00,5,244.40
Μ66Μ,Φλεγμονώδεις παθήσεις μυοσκελετικού με καταστροφικές ή σοβαρές συνυπάρχουσες παθήσεις - επιπλοκές,2436.00,10,243.60
Μ66Χ,Φλεγμονώδεις παθήσεις μυοσκελετικού χωρίς καταστροφικές ή σοβαρές συνυπάρχουσες παθήσεις - επιπλοκές,652.00,2,326.00
Μ67Μ,Σηπτική αρθρίτιδα με καταστροφικές ή σοβαρές συνυπάρχουσες παθήσεις - επιπλοκές,2428.00,12,202.33
Μ67Χ,Σηπτική αρθρίτιδα με καταστροφικές χωρίς σοβαρές συνυπάρχουσες παθήσεις - επιπλοκές,996.00,7,142.29
Μ68Μ,Μη χειρουργικές σκελετικές παθήσεις με συνυπάρχουσες παθήσεις - επιπλοκές,1712.00,9,190.22
Μ68Χ,Μη χειρουργικές παθήσεις νωτιαιου σωλήνα χωρίς συνυπάρχουσες παθήσεις - επιπλοκές,731.00,4,182.75
Μ68Α,Μη χειρουργικές παθήσεις νωτιαιου σωλήνα μιας ημέρας θεραπειών,151.00,1,151.00
Μ69Μ,Παθήσεις οστών και αρθροπάθειες με καταστροφικές ή σοβαρές συνυπάρχουσες παθήσεις - επιπλοκές,1533.00,9,170.33
Μ69Χ,Παθήσεις οστών και αρθροπάθειες χωρίς καταστροφικές ή σοβαρές συνυπάρχουσες παθήσεις - επιπλοκές,428.00,2,214.00
Μ71Μ,Λοιπές παθήσεις μυών-τενόντων με καταστροφικές ή σοβαρές συνυπάρχουσες παθήσεις - επιπλοκές,1323.00,7,189.00
Μ71Χ,Λοιπές παθήσεις μυών-τενόντων χωρίς καταστροφικές ή σοβαρές συνυπάρχουσες παθήσεις - επιπλοκές,405.00,2,202.50
Μ72Μ,Ειδικές παθήσεις μυών - τενόντων με καταστροφικές ή σοβαρές συνυπάρχουσες παθήσεις - επιπλοκές,1681.00,9,186.78
Μ72Χ,Ειδικές παθήσεις μυών - τενόντων χωρίς καταστροφικές ή σοβαρές συνυπάρχουσες παθήσεις - επιπλοκές,490.00,3,163.33
Μ73Μ,Μετεγχειρητική παρακολούθηση μυοσκελετικών μοσχευμάτων/ προθέσεων με καταστροφικές ή σοβαρές συνυπάρχουσες παθήσεις - επιπλοκές,2249.00,18,124.94
Μ73Χ,Μετεγχειρητική παρακολούθηση μυοσκελετικών μοσχευμάτων/ προθέσεων χωρίς καταστροφικές ή σοβαρές συνυπάρχουσες παθήσεις - επιπλοκές,584.00,4,146.00
Μ74Α,"Κακώσεις αντιβραχίου καρπού, χειρός ή ποδός",350.00,2,175.00
Μ75Μ,"Κάκωση ώμου, Βραχιονίου, αγκώνα, γόνατος, ποδιού ή αστραγάλου με συνυπάρχουσες παθήσεις - επιπλοκές",1455.00,8,181.88
Μ75Χ,"Κάκωση ώμου, Βραχιονίου, αγκώνα, γόνατος, ποδιού ή αστραγάλου χωρίς συνυπάρχουσες παθήσεις - επιπλοκές",405.00,2,202.50
Μ76Μ,Λοιπές μυοσκελετικές παθήσεις με καταστροφικές ή σοβαρές συνυπάρχουσες παθήσεις - επιπλοκές,1292.00,7,184.57
Μ76Χ,Λοιπές μυοσκελετικές παθήσεις με καταστροφικές χωρίς σοβαρές συνυπάρχουσες παθήσεις - επιπλοκές,389.00,2,194.50
Μ77Μ,Κατάγματα λεκάνης με καταστροφικές ή σοβαρές συνυπάρχουσες παθήσεις - επιπλοκές,2257.00,13,173.62
Μ77Χ,Κατάγματα λεκάνης με καταστροφικές χωρίς σοβαρές συνυπάρχουσες παθήσεις - επιπλοκές,1058.00,6,176.33
Μ78Μ,Κατάγματα αυχένος του μηριαίου με καταστροφικές ή σοβαρές συνυπάρχουσες παθήσεις - επιπλοκές,1463.00,8,182.88
Μ78Χ,Κατάγματα αυχένος του μηριαίου χωρίς καταστροφικές η σοβαρές συνυπάρχουσες παθήσεις ή επιπλοκές,475.00,2,237.50
Μ79Μ,Παθολογικά κατάγματα με καταστροφικές συνυπάρχουσες παθήσεις - επιπλοκές,2942.00,17,173.06
Μ79Χ,Παθολογικά κατάγματα χωρίς καταστροφικές συνυπάρχουσες παθήσεις - επιπλοκές,1370.00,8,171.25
Δ01Μ,"Μεταφορά μικροαγγειακού μοσχεύματος για διαταραχές δέρματος, υποδορίου ιστού και μαστού με καταστροφικές/σοβαρές συνυπάρχουσες παθήσεις – επιπλοκές",8557.00,15,570.47
Δ01Χ,"Μεταφορά μικροαγγειακού μοσχεύματος για διαταραχές δέρματος, υποδορίου ιστού και μαστού χωρίς καταστροφικές/σοβαρές συνυπάρχουσες παθήσεις – επιπλοκές",6452.00,9,716.89
Δ06Α,Μείζονες επεμβάσεις μαστού,1383.00,3,461.00
Δ07Α,Ελάσσονες επεμβάσεις μαστού,605.00,1,605.00
Δ08Μ,Άλλες επεμβάσεις για δερματικό μόσχευμα και/ ή χειρουργικός καθαρισμός με συνυπάρχουσες παθήσεις – επιπλοκές,2294.00,11,208.55
Δ08Χ,Άλλες επεμβάσεις για δερματικό μόσχευμα και/ ή χειρουργικός καθαρισμός χωρίς συνυπάρχουσες παθήσεις – επιπλοκές,791.00,2,395.50
Δ09Α,Περιοδικές επεμβάσεις και επεμβάσεις τριχοφωλεακού συριγγίου,688.00,2,344.00
Δ10Α,"Χειρουργικές επεμβάσεις πλαστικής δέρματος, υποδορίου ιστού και μαστού",672.00,1,672.00
Δ11Α,"Άλλες χειρουργικές επεμβάσεις πλαστικής δέρματος, υποδορίου ιστού και μαστού",404.00,1,404.00
Δ12Μ,"Επεμβάσεις στα κάτω άκρα με έλκος/ κυτταρίτιδα, με καταστροφικές συνυπάρχουσες παθήσεις - επιπλοκές",4871.00,23,211.78
Δ12ΧΑ,"Επεμβάσεις στα κάτω άκρα με έλκος/ κυτταρίτιδα, χωρίς καταστροφικές συνυπάρχουσες παθήσεις - επιπλοκές με επιδιόρθωση με δερματικό μόσχευμα ή μεταφορά δερματικού κρημνού",3097.00,13,238.23
Δ12ΧΒ,Επεμβάσεις στα κάτω άκρα με έλκος/ κυτταρίτιδα χωρίς καταστροφικές συνυπάρχουσες παθήσεις - επιπλοκές χωρίς επιδιόρθωση με δερματικό μόσχευμα ή μεταφορά δερματικού κρημνού,1774.00,8,221.75
