ken_code,ken_description,basic_cost,mean_duration_days,extra_daily_cost
Α31Μ,Νεοπλάσματα αναπνευστικού με καταστροφικές συνυπάρχουσες παθήσεις - επιπλοκές,179800.0,9,199780.0
Α31Χ,Νεοπλάσματα αναπνευστικού χωρίς καταστροφικές συνυπάρχουσες παθήσεις - επιπλοκές,91000.0,5,18200.0
Α32Α,Αναπνευστικά προβλήματα αναδυόμενα από τη νεογνική περίοδο,84600.0,4,21150.0
Α33ΜΑ,Πλευριτική συλλογή με καταστροφικές συνυπάρχουσες παθήσεις - επιπλοκές,202300.0,10,20230.0
Α33ΜΒ,Πλευριτική συλλογή με σοβαρές ή μεσαίου βαρύτητας συνυπάρχουσες παθήσεις - επιπλοκές,104300.0,5,20860.0
Α33Χ,Πλευριτική συλλογή χωρίς συνυπάρχουσες παθήσεις - επιπλοκές,60700.0,3,202330.0
Α34ΜΑ,Διάμεση πνευμονική νόσος με καταστροφικές συνυπάρχουσες παθήσεις - επιπλοκές,197700.0,10,19770.0
Α34ΜΒ,Διάμεση πνευμονική νόσος με σοβαρές ή μεσαίας βαρύτητας συνυπάρχουσες παθήσεις – επιπλοκές,139300.0,7,19900.0
Α34Χ,Διάμεση πνευμονική νόσος χωρίς συνυπάρχουσες παθήσεις - επιπλοκές,63800.0,3,212670.0
Α35ΜΑ,Λοιπές διαγνώσεις αναπνευστικού συστήματος με καταστροφικές συνυπάρχουσες παθήσεις - επιπλοκές,155600.0,8,19450.0
Α35ΜΒ,Λοιπές διαγνώσεις αναπνευστικού συστήματος με σοβαρές ή μεσαίας βαρύτητας συνυπάρχουσες παθήσεις – επιπλοκές,97300.0,5,19460.0
Α35Χ,Λοιπές διαγνώσεις αναπνευστικού συστήματος χωρίς συνυπάρχουσες παθήσεις - επιπλοκές,47500.0,2,23750.0
Α36Α,Φυματίωση αναπνευστικού,241200.0,14,172290.0
Κ01Μ,"Τοποθέτηση ή αντικατάσταση εμφυτεύσιμου απινιδωτή, ολικό σύστημα με καταστροφικές συνυπάρχουσες παθήσεις - επιπλοκές",1621500.0,12,1351250.0
Κ01Χ,"Τοποθέτηση ή αντικατάσταση εμφυτεύσιμου απινιδωτή, ολικό σύστημα χωρίς καταστροφικές συνυπάρχουσες παθήσεις-επιπλοκές",1242000.0,3,414000.0
Κ02Α,Άλλες επεμβάσεις επί εμφυτεύσιμου απινιδωτή,284400.0,4,71100.0
Κ03Μ,Επεμβάσεις σε καρδιακές βαλβίδες με εξωσωματική κυκλοφορία και με επεμβατικό καρδιακό καθετηριασμό με καταστροφικές συνυπάρχουσες παθήσεις-επιπλοκές,1542900.0,23,670830.0
Κ03Χ,Επεμβάσεις σε καρδιακές βαλβίδες με εξωσωματική κυκλοφορία και με επεμβατικό καρδιακό καθετηριασμό χωρίς καταστροφικές συνυπάρχουσες παθήσεις-επιπλοκές,1173400.0,13,902620.0
Κ04Μ,Επεμβάσεις σε καρδιακές βαλβίδες με εξωσωματική κυκλοφορία χωρίς επεμβατικό καρδιακό καθετηριασμό και με καταστροφικές συνυπάρχουσες παθήσεις-επιπλοκές,1315500.0,14,939640.0
Κ04Χ,Επεμβάσεις σε καρδιακές βαλβίδες με εξωσωματική κυκλοφορία χωρίς επεμβατικό καρδιακό καθετηριασμό και χωρίς καταστροφικές συνυπάρχουσες παθήσεις-επιπλοκές,916300.0,8,1145380.0
Κ05Μ,Αορτοστεφανιαία παράκαμψη με καρδιακό καθετηριασμό με επανεπέμβαση με καταστροφικές συνυπάρχουσες παθήσεις-επιπλοκές,1002300.0,18,556830.0
Κ05Χ,Αορτοστεφανιαία παράκαμψη με καρδιακό καθετηριασμό χωρίς επανεπέμβαση χωρίς καταστροφικές συνυπάρχουσες παθήσεις-επιπλοκές,727000.0,13,559230.0
Κ06Μ,Αορτοστεφανιαία παράκαμψη χωρίς καρδιακό καθετηριασμό με επανεπέμβαση ή με καταστροφικές / σοβαρές συνυπάρχουσες παθήσεις-επιπλοκές,718200.0,10,71820.0
Κ06Χ,Αορτοστεφανιαία παράκαμψη χωρίς καρδιακό καθετηριασμό χωρίς επανεπέμβαση χωρίς καταστροφικές συνυπάρχουσες παθήσεις-επιπλοκές,507700.0,7,725290.0
Κ07ΜΑ,Λοιπές κάρδιο-θώρακοχειρουργικές /αγγειοχειρουργικές επεμβάσεις με εξωσωματική κυκλοφορία με καταστροφικές συνυπάρχουσες παθήσεις-επιπλοκές,1055400.0,12,87950.0
Κ07ΜΒ,Λοιπές κάρδιο-θώρακοχειρουργικές /αγγειοχειρουργικές επεμβάσεις με εξωσωματική κυκλοφορία με σοβαρές ή μετρίας βαρύτητας συνυπάρχουσες παθήσεις-επιπλοκές,727900.0,8,909880.0
Κ07Χ,Λοιπές κάρδιο-θώρακοχειρουργικές /αγγειοχειρουργικές επεμβάσεις με εξωσωματική κυκλοφορία χωρίς συνυπάρχουσες παθήσεις-επιπλοκές,535400.0,7,764860.0
Κ08Μ,Μείζονες επανορθωτικές επεμβάσεις αγγείων χωρίς εξωσωματική κυκλοφορία με καταστροφικές συνυπάρχουσες παθήσεις-επιπλοκές,895600.0,16,559750.0
Κ08Χ,Μείζονες επανορθωτικές επεμβάσεις αγγείων χωρίς εξωσωματική κυκλοφορία χωρίς καταστροφικές συνυπάρχουσες παθήσεις-επιπλοκές,556100.0,7,794430.0
Κ09ΜΑ,Λοιπές κάρδιοθωρακικές χειρουργικές επεμβάσεις χωρίς εξωσωματική κυκλοφορία με καταστροφικές συνυπάρχουσες παθήσεις-επιπλοκές,641300.0,10,64130.0
Κ09ΜΒ,Άλλες κάρδιο-θώρακοχειρουργικές επεμβάσεις χωρίς εξωσωματική κυκλοφορία με σοβαρής ή μέτριας βαρύτητας συνυπάρχουσες παθήσεις-επιπλοκές,361700.0,6,602830.0
Κ09Χ,Άλλες κάρδιο-θώρακοχειρουργικές επεμβάσεις χωρίς εξωσωματική κυκλοφορία χωρίς συνυπάρχουσες παθήσεις-επιπλοκές,238600.0,3,795330.0
Κ10Μ,Επεμβατικές στεφανιαίες επεμβάσεις με ΟΕΜ (οξύ έμφραγμα μυοκαρδίου) με καταστροφικές συνυπάρχουσες παθήσεις-επιπλοκές,416600.0,8,520750.0
Κ10Χ,Επεμβατικές στεφανιαίες επεμβάσεις με ΟΕΜ (οξύ έμφραγμα μυοκαρδίου) χωρίς καταστροφικές συνυπάρχουσες παθήσεις-επιπλοκές,272400.0,4,68100.0
Κ11Μ,"Ακρωτηριασμός λόγω αγγειακής ισχαιμίας, πλην άνω άκρου και δακτύλων άκρου ποδός, με καταστροφικές συνυπάρχουσες παθήσεις-επιπλοκές",729200.0,27,270070.0
Κ11Χ,"Ακρωτηριασμός λόγω αγγειακής ισχαιμίας, πλην άνω άκρου και δακτύλων άκρου ποδός, χωρίς καταστροφικές συνυπάρχουσες παθήσεις-επιπλοκές",322300.0,14,230210.0
Κ12Μ,"Τοποθέτηση ή αντικατάσταση βηματοδότη, ολικού συστήματος, με καταστροφικές συνυπάρχουσες παθήσεις-επιπλοκές",546500.0,11,496820.0
Κ12Χ,"Τοποθέτηση ή αντικατάσταση βηματοδότη, ολικού συστήματος χωρίς καταστροφικές συνυπάρχουσες παθήσεις-επιπλοκές",369400.0,4,92350.0
Κ13Μ,Ακρωτηριασμός άνω άκρου ή δακτύλου άκρου ποδός λόγω νοσήματος κυκλοφορικού με σοβαρού βαθμού ή καταστροφικές συνυπάρχουσες παθήσεις-επιπλοκές,396900.0,17,233470.0
Κ13Χ,Ακρωτηριασμός άνω άκρου ή δακτύλου άκρου ποδός λόγω καρδιαγγειακού νοσήματος χωρίς σοβαρού βαθμού ή καταστροφικές συνυπάρχουσες παθήσεις-επιπλοκές,166000.0,7,237140.0
Κ14ΜΑ,"Αγγειακές επεμβάσεις, πλην μειζόνων επανορθωτικών επεμβάσεων, χωρίς εξωσωματική κυκλοφορία με καταστροφικές συνυπάρχουσες παθήσεις-επιπλοκές",356900.0,11,324450.0
Κ14ΜΒ,"Αγγειακές επεμβάσεις, πλην μειζόνων επανορθωτικών επεμβάσεων, χωρίς εξωσωματική κυκλοφορία, με σοβαρού ή μετρίου βαθμού συνυπάρχουσες παθήσεις-επιπλοκές",199100.0,4,497750.0
Κ14Χ,"Αγγειακές επεμβάσεις, πλην μειζόνων επανορθωτικών επεμβάσεων, χωρίς εξωσωματική κυκλοφορία χωρίς συνυπάρχουσες παθήσεις-επιπλοκές",127700.0,2,63850.0
Κ15Μ,Επεμβατικές στεφανιαίες επεμβάσεις χωρίς ΟΕΜ (οξύ έμφραγμα μυοκαρδίου) με τοποθέτηση ενδοπρόθεσης (stent) με σοβαρού βαθμού ή καταστροφικές συνυπάρχουσες παθήσεις-επιπλοκές,272800.0,4,68200.0
Κ15Χ,Επεμβατικές στεφανιαίες επεμβάσεις χωρίς ΟΕΜ (οξύ έμφραγμα μυοκαρδίου) με τοποθέτηση ενδοπρόθεσης (stent) χωρίς σοβαρού βαθμού ή καταστροφικές συνυπάρχουσες παθήσεις-επιπλοκές,201300.0,2,100650.0
Κ16Μ,Επεμβατικές στεφανιαίες επεμβάσεις χωρίς ΟΕΜ (οξύ έμφραγμα μυοκαρδίου) χωρίς τοποθέτηση ενδοπρόθεσης (stent) με συνυπάρχουσες παθήσεις-επιπλοκές,153100.0,3,510330.0
Κ16Χ,Επεμβατικές μέθοδοι στα στεφανιαία χωρίς ΟΕΜ (οξύ έμφραγμα μυοκαρδίου) χωρίς τοποθέτηση ενδοπρόθεσης (stent) χωρίς συνυπάρχουσες παθήσεις-επιπλοκές,111800.0,2,55900.0
Κ17Μ,Τοποθέτηση ή αντικατάσταση γεννήτριας βηματοδότη με σοβαρού βαθμού ή καταστροφικές συνυπάρχουσες παθήσεις-επιπλοκές,289200.0,5,57840.0
Κ17Χ,Τοποθέτηση ή αντικατάσταση γεννήτριας βηματοδότη χωρίς σοβαρού βαθμού ή καταστροφικές συνυπάρχουσες παθήσεις-επιπλοκές,261700.0,1,261700.0
Κ18Μ,Λοιπές επεμβάσεις με βηματοδότη με συνυπάρχουσες παθήσεις-επιπλοκές,222600.0,7,31800.0
Κ18Χ,Λοιπές επεμβάσεις με βηματοδότη χωρίς συνυπάρχουσες παθήσεις-επιπλοκές,114600.0,2,57300.0
Κ19Α,Διαδερμικές ενδοαγγειακές καρδιακές επεμβάσεις,319400.0,3,1064670.0
Κ20Α,Απολίνωση φλέβας,76000.0,1,76000.0
Κ21Μ,Λοιπές επεμβάσεις νοσημάτων κυκλοφορικού με συνυπάρχουσες παθήσεις-επιπλοκές,368000.0,15,245330.0
Κ21Χ,Λοιπές επεμβάσεις νοσημάτων κυκλοφορικού χωρίς καταστροφικές συνυπάρχουσες παθήσεις-επιπλοκές,149400.0,4,37350.0
Κ22Α,Αορτικά Βαλβιδοφόρα Μοσχεύματα,775300.0,15,516870.0
Κ30Μ,Νοσήματα κυκλοφορικού με μηχανική υποστήριξη αναπνοής (αναπνευστήρα) με καταστροφικές συνυπάρχουσες παθήσεις-επιπλοκές,629500.0,11,572270.0
Κ30Χ,Νοσήματα κυκλοφορικού με μηχανική υποστήριξη αναπνοής (αναπνευστήρα) χωρίς καταστροφικές συνυπάρχουσες παθήσεις-επιπλοκές,447000.0,6,74500.0
Κ31Μ,Νοσήματα κυκλοφορικού με ΟΕΜ με διαγνωστική επεμβατική καρδιακή τεχνική με σοβαρού βαθμού ή καταστροφικές συνυπάρχουσες παθήσεις-επιπλοκές,203800.0,8,254750.0
Κ31Χ,παθήσεις-επιπλοκές του κυκλοφορικού με ΟΕΜ με διαγνωστική επεμβατική καρδιακή τεχνική χωρίς σοβαρού βαθμού ή καταστροφικές συνυπάρχουσες παθήσεις-επιπλοκές,118300.0,4,295750.0
Κ32Α,"παθήσεις-επιπλοκές του κυκλοφορικού χωρίς ΟΕΜ με διαγνωστική επεμβατική καρδιακή τεχνική, την ίδια ημέρα",104300.0,1,104300.0
Κ32Μ,παθήσεις-επιπλοκές του κυκλοφορικού χωρίς ΟΕΜ με διαγνωστική επεμβατική καρδιακή τεχνική με σοβαρού βαθμού ή καταστροφικές συνυπάρχουσες παθήσεις-επιπλοκές,206200.0,8,257750.0
Κ32Χ,παθήσεις-επιπλοκές του κυκλοφορικού χωρίς ΟΕΜ με διαγνωστική επεμβατική καρδιακή τεχνική χωρίς σοβαρού βαθμού ή καταστροφικές συνυπάρχουσες παθήσεις-επιπλοκές,108900.0,3,36300.0
Κ33Α,Διάγνωση κυκλοφορικού με μη επεμβατικό μηχανικό αερισμό,313200.0,13,240920.0
Κ40Μ,Διαταραχές κυκλοφορικού με ΟΕΜ χωρίς διαγνωστική επεμβατική καρδιακή τεχνική με καταστροφικές συνυπάρχουσες παθήσεις-επιπλοκές,200000.0,10,20000.0
Κ40Χ,Διαταραχές κυκλοφορικού με ΟΕΜ χωρίς διαγνωστική επεμβατική καρδιακή τεχνική χωρίς καταστροφικές συνυπάρχουσες παθήσεις-επιπλοκές,79400.0,3,264670.0
Κ41Μ,Λοιμώδης ενδοκαρδίτιδα με καταστροφικές συνυπάρχουσες παθήσεις-επιπλοκές,480100.0,22,218230.0
Κ41Χ,Λοιμώδης ενδοκαρδίτιδα χωρίς καταστροφικές συνυπάρχουσες παθήσεις-επιπλοκές,239700.0,12,199750.0
Κ42Μ,Καρδιακή ανεπάρκεια και καταπληξία (SCHOCK) με καταστροφικές συνυπάρχουσες παθήσεις,205400.0,10,20540.0
Κ42Χ,Καρδιακή ανεπάρκεια και καταπληξία (SCHOCK) χωρίς καταστροφικές συνυπάρχουσες παθήσεις,93400.0,5,18680.0
Κ43Μ,Φλεβοθρόμβωση με σοβαρού βαθμού ή καταστροφικές συνυπάρχουσες παθήσεις-επιπλοκές,147100.0,8,183880.0
Κ33Χ,Φλεβοθρόμβωση χωρίς σοβαρού βαθμού ή καταστροφικές συνυπάρχουσες παθήσεις-επιπλοκές,66900.0,5,13380.0
Κ34Μ,Δερματικά έλκη σε παθήσεις-επιπλοκές κυκλοφορικού με σοβαρού βαθμού ή καταστροφικές συνυπάρχουσες παθήσεις-επιπλοκές,223300.0,13,171770.0
Κ34Χ,Δερματικά έλκη σε παθήσεις-επιπλοκές κυκλοφορικού χωρίς σοβαρού βαθμού ή καταστροφικές συνυπάρχουσες παθήσεις-επιπλοκές,98100.0,5,19620.0
Κ35Μ,Περιφερική αγγειοπάθεια με σοβαρού βαθμού ή καταστροφικές συνυπάρχουσες παθήσεις-επιπλοκές,150200.0,7,214570.0
Κ35Χ,Περιφερική αγγειοπάθεια χωρίς σοβαρού βαθμού ή καταστροφικές συνυπάρχουσες παθήσεις-επιπλοκές,52100.0,2,26050.0
Κ36Μ,Αθηρωμάτωση στεφανιαίων αρτηριών με σοβαρού βαθμού ή καταστροφικές συνυπάρχουσες παθήσεις-επιπλοκές,95700.0,5,19140.0
Κ36Χ,Αθηρωμάτωση στεφανιαίων αρτηριών χωρίς σοβαρού βαθμού ή καταστροφικές συνυπάρχουσες παθήσεις-επιπλοκές,37400.0,2,18700.0
Κ37Μ,Αρτηριακή υπέρταση με σοβαρού βαθμού ή καταστροφικές συνυπάρχουσες παθήσεις-επιπλοκές,119800.0,6,199670.0
Κ37Χ,Αρτηριακή υπέρταση χωρίς σοβαρού βαθμού ή καταστροφικές συνυπάρχουσες παθήσεις-επιπλοκές,45900.0,2,22950.0
Κ38Μ,Συγγενής καρδιοπάθεια με συνυπάρχουσες παθήσεις-επιπλοκές,128400.0,4,32100.0
Κ38Χ,Συγγενής καρδιοπάθεια χωρίς συνυπάρχουσες παθήσεις-επιπλοκές,62700.0,1,62700.0
Κ39Μ,Βαλβιδοπάθειες με σοβαρού βαθμού ή καταστροφικές συνυπάρχουσες παθήσεις-επιπλοκές,126800.0,6,211330.0
Κ39Χ,Βαλβιδοπάθειες χωρίς σοβαρού βαθμού ή καταστροφικές συνυπάρχουσες παθήσεις-επιπλοκές,32700.0,2,16350.0
Κ43Χ,Συγκοπή και λιποθυμία χωρίς σοβαρού βαθμού ή καταστροφικές συνυπάρχουσες παθήσεις-επιπλοκές,39700.0,2,19850.0
Κ44Α,Θωρακικό άλγος,31100.0,1,31100.0
Κ45ΜΑ,Λοιπές παθήσεις-επιπλοκές κυκλοφορικού με καταστροφικές συνυπάρχουσες παθήσεις-επιπλοκές,242800.0,10,24280.0
Κ45ΜΒ,Λοιπές παθήσεις-επιπλοκές κυκλοφορικού με μετρίου ή σοβαρού βαθμού συνυπάρχουσες παθήσεις-επιπλοκές,101900.0,4,254750.0
Κ45Χ,Λοιπές παθήσεις-επιπλοκές κυκλοφορικού χωρίς συνυπάρχουσες παθήσεις-επιπλοκές,52100.0,2,26050.0
Κ46Μ,"Αρρυθμία, καρδιακή ανακοπή και διαταραχές αγωγιμότητας με σοβαρού βαθμού ή καταστροφικές συνυπάρχουσες παθήσεις-επιπλοκές",124500.0,6,20750.0
Κ46Χ,"Αρρυθμία, καρδιακή ανακοπή και διαταραχές αγωγιμότητας χωρίς σοβαρού βαθμού ή καταστροφικές συνυπάρχουσες παθήσεις-επιπλοκές",44400.0,2,22200.0
Κ47Α,Κατάλυση αρρυθμιογόνων εστιών,242300.0,6,403830.0
Π01Μ,Εκτομή ορθού με καταστροφικές συνυπάρχουσες παθήσεις - επιπλοκές,648900.0,18,36050.0
Π01Χ,Εκτομή ορθού χωρίς καταστροφικές συνυπάρχουσες παθήσεις - επιπλοκές,385700.0,9,428560.0
Π02Μ,Μείζονες επεμβάσεις λεπτού και παχέος εντέρου με καταστροφικές συνυπάρχουσες παθήσεις - επιπλοκές,574100.0,17,337710.0
Π02Χ,Μείζονες επεμβάσεις λεπτού και παχέος εντέρου χωρίς καταστροφικές συνυπάρχουσες παθήσεις - επιπλοκές,277100.0,8,346380.0
Π03Μ,"Επεμβάσεις στομάχου, οισοφάγου και δωδεκαδακτύλου με κακοήθεια ή με καταστροφικές συνυπάρχουσες παθήσεις - επιπλοκές",690800.0,17,406350.0
Π03ΧΑ,"Επεμβάσεις στομάχου, οισοφάγου και δωδεκαδάκτυλου χωρίς κακοήθεια και σοβαρές ή μεσαίας βαρύτητας συνυπάρχουσες παθήσεις - επιπλοκές",282600.0,8,353250.0
Π03ΧΒ,"Επεμβάσεις στομάχου, οισοφάγου και δωδεκαδάκτυλου χωρίς κακοήθεια χωρίς συνυπάρχουσες παθήσεις - επιπλοκές",181300.0,4,453250.0
Π04ΜΑ,Λύση περιτοναϊκών συμφύσεων με καταστροφικές συνυπάρχουσες παθήσεις - επιπλοκές,484700.0,16,302940.0
Π04ΜΒ,Λύση περιτοναϊκών συμφύσεων με σοβαρές ή μεσαίας βαρύτητας συνυπάρχουσες παθήσεις - επιπλοκές,271000.0,9,301110.0
Π04Χ,Λύση περιτοναϊκών συμφύσεων χωρίς συνυπάρχουσες παθήσεις - επιπλοκές,157800.0,4,39450.0
Π05ΜΑ,Μικρές επεμβάσεις λεπτού και παχέος εντέρου με καταστροφικές συνυπάρχουσες παθήσεις - επιπλοκές,332900.0,12,277420.0
Π05ΜΒ,Μικρές επεμβάσεις λεπτού και παχέος εντέρου με σοβαρές ή μεσαίας βαρύτητας συνυπάρχουσες παθήσεις - επιπλοκές,208500.0,7,297860.0
Π05Χ,Μικρές επεμβάσεις λεπτού και παχέος εντέρου χωρίς συνυπάρχουσες παθήσεις - επιπλοκές,137900.0,4,344750.0
Π06Α,Επεμβάσεις πυλορομυοτομής,103700.0,3,345670.0
Π07Μ,Σκωληκοειδεκτομή με κακοήθεια ή περιτονίτιδα ή με καταστροφικές ή σοβαρές συνυπάρχουσες παθήσεις - επιπλοκές,155000.0,5,31000.0
Π07Χ,Σκωληκοειδεκτομή χωρίς κακοήθεια ή περιτονίτιδα ή χωρίς καταστροφικές ή σοβαρές συνυπάρχουσες παθήσεις - επιπλοκές,98300.0,2,49150.0
Π10Μ,"Επεμβάσεις κηλών (βουβωνοκήλες, ομφαλοκήλες κτλ) με συνυπάρχουσες παθήσεις - επιπλοκές",169700.0,5,33940.0
Π10Χ,"Επεμβάσεις κηλών (βουβωνοκήλες, ομφαλοκήλες κτλ) χωρίς συνυπάρχουσες παθήσεις - επιπλοκές",86800.0,1,86800.0
Π11Α,Επεμβάσεις που αφορούν κωλοστομίες και πρωκτό,56600.0,2,28300.0
Π12ΜΑ,Λοιπές Επεμβάσεις πεπτικού συστήματος με καταστροφικές συνυπάρχουσες παθήσεις - επιπλοκές,417700.0,16,261060.0
Π12ΜΒ,Λοιπές Επεμβάσεις πεπτικού συστήματος με σοβαρές ή μεσαίας βαρύτητας συνυπάρχουσες παθήσεις - επιπλοκές,193200.0,7,27600.0
Π12Χ,Λοιπές Επεμβάσεις πεπτικού συστήματος χωρίς συνυπάρχουσες παθήσεις - επιπλοκές,96700.0,3,322330.0
Π26Μ,Συνδυασμένη γαστροσκόπιση με καταστροφικές συνυπάρχουσες παθήσεις - επιπλοκές,333800.0,14,238430.0
Π26Χ,Συνδυασμένη γαστροσκόπιση χωρίς καταστροφικές συνυπάρχουσες παθήσεις - επιπλοκές,124500.0,5,24900.0
Π26Α,"Συνδυασμένη γαστροσκόπιση, την ίδια ημέρα",33000.0,1,33000.0
Π27Μ,Λοιπές επεμβάσεις γαστροσκόπισης με καταστροφικές συνυπάρχουσες παθήσεις - επιπλοκές,252100.0,12,210080.0
Π27Χ,Λοιπές επεμβάσεις γαστροσκόπισης χωρίς καταστροφικές συνυπάρχουσες παθήσεις - επιπλοκές,98800.0,4,24700.0
Π27Α,"Λοιπές επεμβάσεις γαστροσκόπισης, την ίδια ημέρα",26500.0,1,26500.0
